author,title,text,tags,isbn,isbn13
Molly Tanzer,Vermilion,"Molly Tanzer's keen imagination is on display in her new novel, <em>Vermilion,</em> a work of alternative history that finds fresh magic in the mingling of fact and fantasy. In the book's wild vision of the Wild West circa 1870, ghosts linger to haunt the living. Enter Elouise ""Lou"" Merriwether, who ushers the dead to their final resting place, along the way becoming one of speculative fiction's most compelling protagonists in recent memory. <em>Vermilion</em> is a unique, thought-provoking romp that rewrites the past with a vivacious flourish.","[eye-opening-reads, historical-fiction, ladies-first, science-fiction-and-fantasy]",1939905087,9781939905086
N.K. Jemisin,The Fifth Season,"N. K. Jemisin's latest novel, <em>The Fifth Season,</em> takes place in a land called the Stillness — a tragically ironic name, since it suffers geographical cataclysms on a periodic basis. Essun, a schoolteacher whose husband inexplicably kills their son and flees with their daughter, undergoes a quest across the Stillness that starts out as a rescue but becomes something else entirely. Jemisin brilliantly illustrates that imaginative world-building is a vital element of fantasy, but also that every character can be a world unto herself.","[science-fiction-and-fantasy, seriously-great-writing, the-dark-side]",0316229296,9780316229296
Paula McLain,Circling The Sun: A Novel,"As chronicled in this richly textured novel, aviator Beryl Markham's life is the stuff of legend. The narrative focuses on Markham's life through her 20s; she tells her story from the cockpit of her plane during her record-breaking Atlantic flight. Born Beryl Clutterbuck, raised in British East Africa to a neglectful mother and a racehorse-trainer father, she models fearlessness throughout her life. At the heart of the story is Markham's romantic liaison with the iconic big-game-hunter Denys Finch Hatton (of <em>Out of Africa</em> fame). Paula McLain has created a voice that is lush and intricate to evoke a character who is enviably brave and independent.","[book-club-ideas, historical-fiction, ladies-first, realistic-fiction, tales-from-around-the-world]",0345534182,9780345534187
Stephen Jarvis,Death And Mr. Pickwick: A Novel,"<em>The Pickwick Papers</em>, serialized in 1836, made Charles Dickens — then writing under the pen name ""Boz"" — famous. The illustrator of the work was a then-well-known caricaturist named Robert Seymour. Stephen Jarvis' debut novel dramatizes the origin story of <em>The Pickwick Papers</em>, bringing Dickens and Seymour alive in rollicking scenes of early 19th century England. Driving the narrative are the circumstances of Seymour's spark of an idea for <em>Pickwick</em>, his shocking suicide and Dickens' later claim of authorship. In the end, though, Jarvis' arguments about who concocted the book seem less important than the Dickensian/Seymourian atmosphere he creates.","[eye-opening-reads, historical-fiction, rather-long, realistic-fiction]",0374139660,9780374139667
Alice Hoffman,The Marriage Of Opposites,"Alice Hoffman's brilliant paint box of a book is set in the early 1800s in the town of Charlotte Amalie, on the island of St. Thomas. Here we meet the family of Camille Pissarro — the Impressionist painter who will soon rise to fame — starting with his mother, Rachel. (Camille is her favorite son.) As in Hoffman's previous work, this book is rich with magical realism. There's a busy panoply of characters, aunts and cousins and random stepfathers. Forbidden marriages abound. And underlying the relationships is a lavish Caribbean canvas: The parrots in the trees, the coconut cake, the scent of jasmine.","[book-club-ideas, family-matters, for-art-lovers, historical-fiction, realistic-fiction, tales-from-around-the-world]",1451693591,9781451693591
Aislinn Hunter,The World Before Us: A Novel,"A gaggle of querulous ghosts narrates the events in this novel by Aislinn Hunter, who brings a moody grace to the phantoms and to her telling of this quirky tale. Protagonist Jane works as an archivist at an eccentric, musty museum, and on the side she investigates the 1877 disappearance of a girl in the English countryside. The twist: As a teen, Jane's 5-year-old charge went missing in these same woods. Ghost-story tropes abound, from a spooky abandoned asylum to a haunted country house, and at the center is a brutal, long-buried crime. The novel's tough truths make <em>The World Before Us</em> a memorable read.","[historical-fiction, mysteries-and-thrillers, science-fiction-and-fantasy, tales-from-around-the-world, the-dark-side]",0553418521,9780553418521
"Alan Pauls, translated by Ellie Robins",A History Of Money: A Novel,"In <em>A History of Money,</em> Argentine novelist Alan Pauls frames a brilliant and absorbing tale through the lens of money and materialism. Translated by Ellie Robins, the novel delves into the troubled political and economic history of Argentina. As great stories often do, it begins with a body, that of a steel company executive who is sent to deliver an attache case full of money but dies in a helicopter crash. Was this event an accident or a planned execution? The unnamed narrator asks these questions while also weaving in stories concerning his personal history with money and how it complicates our lives. Pauls' book is beautifully textured and chock-full of sentences that dazzle consistently.","[historical-fiction, rather-short, realistic-fiction, tales-from-around-the-world]",1612194230,9781612194233
"Yoss, translated by David Frye",A Planet For Rent,"<em>A Planet for Rent</em> is the English-language debut of Yoss, one of Cuba's most lauded writers of science fiction. Translated by David Frye, these linked stories craft a picture of a dystopian future: Aliens called xenoids have invaded planet Earth, and people are looking to flee the economically and socially bankrupt remains of human civilization. Yoss' smart and entertaining novel tackles themes like prostitution, immigration and political corruption. Ultimately, it serves as an empathetic yet impassioned metaphor for modern-day Cuba, where the struggle for power has complicated every facet of society","[book-club-ideas, science-fiction-and-fantasy, tales-from-around-the-world]",1632060361,9781632060365
"Alejandro Zambra, translated by Megan McDowell",My Documents,"In <em>My Documents,</em> a collection of 11 stories translated by Megan McDowell, Alejandro Zambra tells stories as only he can. He finds the foundations for his most enthralling work in the complex ties between fathers and sons, nations and their people, and, especially, hapless lovers. To read Zambra and a collection like <em>My Documents</em> is to engage with someone who writes as though the burden of history was upon him and no one else — the history of his country of Chile, of literature and of humanity's shared experience. Put simply, the novel is a force, and further proof that the author is in a class of his own.","[family-matters, poetry, realistic-fiction, seriously-great-writing, tales-from-around-the-world]",1940450527,9781940450520
"Clarice Lispector, translated by Katrina Dodson",The Complete Stories,"In <em>The Complete Stories,</em> Clarice Lispector proves herself to be a true master of narrative. The collection, translated by Katrina Dodson, is a perfect introduction to those not familiar with Lispector's work, beautifully structured and poignant on all levels. Stories like ""The Escape"" and ""Daydream and Drunkenness of a Young Lady"" — which deals with a discontented housewife on the brink of insanity — stay with you like a kind of dream. These 85 stories, some only a few pages long, reaffirm Lispector's singularity and her reputation as ""the great witch of Brazilian literature."" Long after her death, Lispector continues to champion the possibilities of language, and its ability to mesmerize.","[poetry, seriously-great-writing, tales-from-around-the-world]",0811219631,9780811219631
"Boris Strugatsky, Arkady Strugatsky, translated by Josh Billings",The Dead Mountaineer's Inn: One More Last Rite For The Detective Genre,"<em>The Dead Mountaineer's Inn,</em> by the brothers Boris and Arkady Strugatsky, is a smart and deeply funny tale that sends its readers down unpredictable paths. First published in 1970, and translated from the Russian for the first time by Josh Billings, the novel follows police inspector Peter Glebsky, a family man anticipating his first vacation in years. Shortly after he arrives at his inn, however, strange events begin to unfold, and Glebsky realizes his vacation will be anything but relaxing. After a body surfaces, the story reaches a new level of strangeness, throwing readers into a detective story that is nothing short of exhilarating.","[science-fiction-and-fantasy, tales-from-around-the-world]",161219432X,9781612194325
Catie Disabato,The Ghost Network: A Novel,"<em>The Ghost Network</em> is Catie Disabato's sharp and inventive debut novel. It's the story of pop star Molly Metropolis, who vanishes mysteriously while en route to a show in Chicago. Her personal assistant, Nix, takes on the role of detective, searching for clues in Molly's journal and going down a rabbit hole of abandoned subway lines, song lyrics and secret societies. Disabato builds a fast-paced and brilliantly structured story that is at once fiercely controlled and highly obsessive.","[for-music-lovers, mysteries-and-thrillers, realistic-fiction]",1612194346,9781612194349
"Nathalie Sarraute, translated by Maria Jolas",Tropisms,"Originally published in 1939, <em>Tropisms</em> is the stunning debut of the late Nathalie Sarraute, long considered one of France's most important writers. Sarraute, whose work went on to be translated into dozens of languages, once described her work as the ""interior movements that precede and prepare our words and actions, at the limits of our consciousness."" This collection of vignettes, made up of short scenes and anecdotes, reads like quiet prose poems that stay with the reader. Translated by Maria Jolas, <em>Tropisms</em> is a masterpiece, short but powerful in every sense.","[for-history-lovers, poetry, tales-from-around-the-world]",0811222764,9780811222761
"Alejandro Jodorowsky, translated by Alfred MacAdam",Where The Bird Sings Best,"<em>Where the Bird Sings Best</em> is Alejandro Jodorowsky's brilliant, mad and unpredictable semi-autobiographical novel. Translated by Alfred MacAdam, this multigenerational chronicle introduces a host of memorable characters, from a dwarf prostitute and a floating ghost-Rabbi to a lion tamer who eats raw meat and teaches his beasts to jump through flaming hoops. Fantastical elements aside, <em>Where the Bird Sings Best</em> is a fiercely original immigration tale that culminates in the author's birth in Chile in 1929 — a complicated time in that nation's history. Combine that with poetry, tarot and Jewish mysticism and you have a genius's surreal vision brought to life.","[family-matters, historical-fiction, science-fiction-and-fantasy, seriously-great-writing, tales-from-around-the-world, the-dark-side]",1632060280,9781632060280
Michael Cunningham,A Wild Swan: And Other Tales,"Michael Cunningham calls his reworked fairy tales ""curses"" and ""incantations""; he plays with the sexy, warts-and-all stuff that happens after the happy ending ""fell on everyone like a guillotine's blade."" Snow White's prince harbors a fetish for ogling his beloved in deathlike sleep — a scenario he asks her to re-enact over and over again. The most human and heartbreaking character you'll encounter is classically one of the more odious ones: Rumpelstiltskin, who desperately wants a child of his own. And the witch from Hansel and Gretel? By the time the twins — recast as libidinous and broken punk teenagers — shove her aged flesh and bones into the oven, it's a mercy.","[poetry, science-fiction-and-fantasy, seriously-great-writing, the-dark-side]",0374290253,9780374290252
Carrie Brownstein,Hunger Makes Me A Modern Girl: A Memoir,"Rock fans know Carrie Brownstein as one of the voices behind legendary riot grrrl outfit Sleater-Kinney, and comedy fans know her as Fred Armisen's partner in the show <em>Portlandia.</em> She defies expectations once again with her new memoir, which is candid and brave, and a powerful tribute to the power of music to heal, to connect, to break you down and then make you whole again. Brownstein proves to be a funny, elegant writer, and her book is wholly original. Her music has always helped people feel like they really do belong somewhere, and her wonderful memoir does the same thing.","[biography-and-memoir, book-club-ideas, family-matters, for-music-lovers, nonfiction, seriously-great-writing]",1594486638,9781594486630
Anne-Marie Slaughter,Unfinished Business: Women Men Work Family,"Anne Marie Slaughter has spent the bulk of her career thinking about matters of war and peace, national security and diplomacy and everything else wrapped up in the world of foreign policy. But in 2012, the former dean of Princeton's School of International Affairs waded into the cultural debate about work/life balance with an article in <em>The Atlantic</em> called ""Why Women Still Can't Have it All."" In <em>Unfinished Business,</em> Slaughter fleshes out a broader argument about why women and men are not given the support they need to pursue meaningful work and raise families. What makes this book so compelling is the shifting perspective between Slaughter and her husband, Andrew Moravcsik, who for several years has been the ""lead parent"" in their family. It's a must-read for any working couple trying to find the time to be good employees, good parents and — oh yeah — good partners to each other.","[staff-picks, book-club-ideas, eye-opening-reads, family-matters, ladies-first, nonfiction]",0812994566,9780812994568
Peter Meehan,Lucky Peach Presents 101 Easy Asian Recipes,"Sure, the recipes are clear and well-written. The introductions and explanations are charming, and that incredible shot of the Lacquered Roast Chicken looks like exactly what I want to eat right now. But my favorite parts of this book (which comes out of a brilliant food magazine run by chef David Chang and food writer Peter Meehan) are the huge photo spreads detailing exactly which brands of Asian ingredients the authors favor — sure to save this intrepid shopper many hours of scrutinizing different bottles of cooking wine, preserved black beans and jars of spicy chili crisp in the aisles of her local Chinese supermarket.","[staff-picks, cookbooks-and-food]",0804187797,9780804187794
Olia Hercules,Mamushka: Recipes From Ukraine And Eastern Europe,"In the era of all things Sichuan-blasted and bacon-infused, this lovely Ukrainian cookbook is a breath of fresh air. Sections on homemade dumplings and breads are delightful, and simple soups like duck and sorrel or mushroom with buckwheat look downright healthful. Plus, author Olia Hercules' stories of camping with her family by the Dnieper River and collecting duck eggs from her mother's yard will have you dreaming of a new life and a fresh, seasonal approach to cooking.","[staff-picks, cookbooks-and-food, family-matters, tales-from-around-the-world]",1616289619,9781616289614
Danny Bowien and Chris Ying,The Mission Chinese Food Cookbook,"This isn't really a cookbook in the sense that you're actually going to make anything from it. Almost nothing here is easy enough for a dinner party, let alone a weeknight meal (I see you, ""Beggar's Duck"" baked in clay). But if you're lucky enough to have visited Danny Bowein's bicoastal Mission Chinese restaurants (or even if you haven't) you'll be fascinated by his stories of time spent in various restaurant kitchens and inspired by his bold flavors (Chongqing Chicken Wings) and playful approach to classic foods from around the world (Kung Pao Pastrami).","[staff-picks, cookbooks-and-food]",0062243411,9780062243416
Shirley Jackson,"Let Me Tell You: New Stories, Essays, And Other Writings","""The Lottery"" author Shirley Jackson died in 1965, so it's surprising to see new, uncollected material still coming to light. Even more surprising: Much of this material is marvelous. It ranges from comic essays that reveal Jackson's playful, even ridiculous side to powerful stories fit for the classics shelf. <em>Let Me Tell You</em> is unmistakably an attic-clearing anthology, packing together odds and sods like an unfinished character sketch and a Dr. Seuss review. But the best material is revelatory, revealing again how Jackson drew indelible characters with a few sparse words, then sent them off on wild adventures.","[funny-stuff, ladies-first, poetry, realistic-fiction, science-fiction-and-fantasy, seriously-great-writing]",0812997662,9780812997668
Michelle Falkoff,Playlist For The Dead,"2015 was a banner year for realism-based drama in young adult novels. The post-apocalyptic dystopias of the <em>Hunger Games</em> era have largely given way to personal apocalypses, and <em>Playlist For The Dead</em> centers on a big one: a 15-year-old trying to understand his best friend's suicide by listening to his music. It's remarkable for its structure, which invites readers to ponder how songs like Radiohead's ""How To Disappear Completely"" or Wilco's ""How To Fight Loneliness"" would sound to a depressed, bullied outcast. But it's also touching for the conclusions Falkoff reaches, which aren't as pat and simple as the song titles.","[for-music-lovers, realistic-fiction, young-adult]",006231050X,9780062310507
David Lagercrantz,The Girl In The Spider's Web: A Lisbeth Salander Novel,"When David Lagercrantz was hired to continue Stieg Larsson's internationally best-selling ""Millennium"" series, he inherited an ugly public-relations problem: a family war being fought over Larsson's estate and literary legacy. So he mostly ignored it to produce the best novel he could. And for series fans, it's hard to deny that he did a memorable job, respecting Larsson's characters, then confidently expanding them. This isn't the novel Larsson would have written, but it's dense, thoughtful and compelling, with its own strong voice and its own take on Lisbeth Salander.","[mysteries-and-thrillers, the-dark-side]",0385354282,9780385354288
Terry Pratchett,The Shepherd's Crown,"The final novel in Terry Pratchett's long-running, best-selling ""Discworld"" series was clearly written as a gentle goodbye to his legions of fans, practically an instruction manual in dealing with his impending death. It begins with the death of one of his most beloved, venerable characters, but sends her off with no-nonsense respect, then firmly shows how the world copes without her. It's startlingly personal for a fantasy novel about witches and elves. But Pratchett spent decades using real-world parallels to turn his books into guidebooks on wisdom, empathy and kindness. It's no surprise his swan song continues the tradition.","[book-club-ideas, ladies-first, science-fiction-and-fantasy, young-adult]",0062429973,9780062429971
Daniel Handler,We Are Pirates,"""Gwen glared at everywhere,"" runs one sentence in Daniel Handler's latest adult novel. The author who brought baroque, morose vocabulary lessons to kids' books as Lemony Snicket usually isn't as wry and acerbic in his adult work. But he makes occasional exceptions, bringing a lightness and a sense of play to this story about an unhappy teenager who wants to be a modern pirate and her unhappy father, who has a more conventional plan for escape. Somewhere between a fable, a family drama, an issue-based YA novel and a dark comedy, <em>We Are Pirates<em> has unpredictability going for it. It glares at everywhere, then laughs at it too.","[family-matters, funny-stuff, the-dark-side]",1608196887,9781608196883
Garth Risk Hallberg,City On Fire: A Novel,"Some people look at a giant novel with dread. Then there are those of us who approach it with reverence, even glee. If you're the latter, you're probably aware of Garth Risk Hallberg's debut doorstop, <em>City on Fire,</em> because of the hype that surrounded its publication. Is the book worth the nearly $2 million Knopf paid for it? That's for you to decide, but I can assure you that it is certainly worth reading all 944 pages. Hallberg is incapable of writing a boring sentence, and the story, set in 1977 New York City, has multiple narrators and myriad threads — but each piece fits together so tightly, you'll actually want to read to the end to see how the whole picture develops.","[staff-picks, book-club-ideas, family-matters, historical-fiction, rather-long, realistic-fiction, seriously-great-writing]",0385353774,9780385353779
Tracy K. Smith,Ordinary Light: A Memoir,"Tracy K. Smith's memoir, <em>Ordinary Light,</em> is anything but ordinary — but she performs the magic trick of writing with such beautiful simplicity that you don't notice the language until you realize you've stopped to grab a tissue. This is of course because memoir is not her first language — Smith is a Pulitzer Prize-winning poet. This book is the story of her early life, her faith and her experiences with race. It's also about her relationship with her mother and her mother's death from cancer. Smith's pain and confusion — and the process of learning to live without her mother — are all told with beauty and sensitivity. She is a master of poetry, prose and philosophy.","[staff-picks, biography-and-memoir, book-club-ideas, family-matters, nonfiction, seriously-great-writing]",0307962660,9780307962669
Rachel Cusk,Outline: A Novel,"If there's a writer who marries thinking and writing with more muscularity than Rachel Cusk — well, introduce me. <em>Outline</em> is the oddest of books, in which a writer travels to Athens to run a writing workshop. On the journey she engages in conversations, listening, sometimes without comment. That's all it is — a series of chats, of observations — but it suddenly becomes so intensely observed that you realize you're not holding a novel; you're holding a blade. No book in 2015 ruffled me more — I found myself waking in the night to spend time with its icy-hot precision, its crisp writing, and the opportunity to hold its mirror to my own mind.","[staff-picks, book-club-ideas, ladies-first, realistic-fiction, seriously-great-writing]",0374228345,9780374228347
Jonathan Bate,Ted Hughes: The Unauthorised Life,"If poetry is humanity's answer to death, then the literary feud may be the poet's answer. One feud that may never die is between the acolytes of Ted Hughes and Sylvia Plath: Plath's blame him for her suicide, while Hughes' blame mental illness. Jonathan Bate's new biography stokes the flames, bravely taking on the literary giant, while quite wisely admitting that Plath's suicide is absolutely at the heart of the man's life. But Bate's scholarship, while not quite excusing Hughes' character flaws, does a beautiful job of marrying his subject's life to his rigorous and important work. The book is as insightful and charismatic as the man himself — whichever side you believe yourself to be on.","[staff-picks, biography-and-memoir, family-matters, for-art-lovers, for-history-lovers, nonfiction, poetry, rather-long]",0062362437,9780062362438
Jeanette Winterson,The Gap Of Time: A Novel,"Re-imagined Shakespeare is, of course, everyone's bag — I'm looking at you, Baz Luhrmann — but there's a special frisson when you marry an old play with a thoroughly modern author. Jeanette Winterson's retelling of <em>A Winter's Tale</em> shimmers with energy in a way I hope the Bard would have loved. The setting is a modern American city (which could be New Orleans). Leontes is a hedge fund manager with a fully fleshed out back story and real clues to his behavior (which are tough to find in the source material). This is a book that will appeal to any fan of a good yarn; Winterson keeps the action pumping. Even if you already know the play it's a well-told tale of modern jealousy and power.","[staff-picks, book-club-ideas, family-matters, for-art-lovers, tales-from-around-the-world]",0804141355,9780804141352
Geraldine Brooks,The Secret Chord: A Novel,"If you're one of those feminists who find the Bible a bit hard to take as literature (where are all the female characters?), well, Happy Hanukkah, have I got one for you. Geraldine Brooks has retold the story of David, giving a fuller look at stories that might have made you raise your eyebrows as written: the friendship between Yonatan and David, the seduction of Batsheva, the relationship with Avigail. A fight between David and Mikhal, one of David's wives, positively sings with an anger and bitterness any woman might recognize in a fight for agency. Brooks may take King David as her subject, but it's her minor characters who come into the greatest relief.","[staff-picks, historical-fiction, ladies-first]",0670025771,9780670025770
Ali Benjamin,The Thing About Jellyfish,"Young adult literature often takes grief as its subject — whether in Terabithia or at a cancer support group. Ali Benjamin's beautiful debut also deals in death and somehow feels both familiar and innovative. The broad strokes: Suzy's best friend, Franny, dies while swimming in the ocean, after the girls had become estranged. Suzy craves answers — and convinces herself that a rare, poisonous jellyfish must be at fault for Franny's death. Along the way, the reader — and Suzy — learn a lot of scientific facts. But there are, of course, no good answers to why scary and sad things happen. Benjamin illuminates what we can learn in a voice that will appeal to both kids and adults.","[staff-picks, book-club-ideas, kids-books, realistic-fiction]",0316380865,9780316380867
