author,title,text,tags,isbn,isbn13
Scott Anderson,"Lawrence In Arabia: War, Deceit, Imperial Folly And The Making Of The Modern Middle East","<p>After covering daily news from Syria for more than two years, there are times I read history as a guide to the outcome: In the Middle East, it's bad, and Scott Anderson's book tells us why.</p>
<p>It's a group biography that weaves the stories of legendary British officer T.E. Lawrence, who played a key role in the Arab revolt against the Ottoman Turks during World War I; German Curt Prufer, who conspired with the Ottomans; Zionist agronomist Aaron Aaronsohn, who made the desert bloom; and American oil company representative William Yale, who spied for the State Department. Yale is the least accomplished character, but the hapless American gives Anderson the grist to deliver his verdict on U.S. policy then and now. Analyzing a muddled dispatch Yale sent to Washington, Anderson writes: ""He was establishing a tradition of fundamentally misreading the situation in the Middle East that his successors in the American intelligence community would rigorously maintain for the next 95 years."" This is a book about muddling and meddling. It couldn't come at a better time.</p>","[npr-staff-picks, science-and-society, for-history-lovers, rather-long, tales-from-around-the-world]",038553292X,9780385532921
Rainbow Rowell,Eleanor & Park,"<em>Eleanor & Park</em> is a book about two teenagers who fall in love. But more than that, it's about feeling lost &mdash; because of bullying, because of abuse, because of race &mdash; and feeling loved. It captures the pure, visceral thrill of a high school swoon, but it never forgets that those feelings are real and important. Rowell's willingness to portray real ugliness and real pain means that when Eleanor and Park are daring to hope for something wonderful for themselves, the stakes feel enormous. It's called a young adult book, and indeed, it's a fine thing to give a sensitive kid. But there's nothing unsophisticated or less than serious about this empathetic, beautifully rendered novel.","[npr-staff-picks, young-adult, love-stories, the-dark-side, family-matters]",1250012570,9781250012579
Daniel Woodrell,The Maid's Version: A Novel,"Daniel Woodrell is best-known for dark tales of the Ozarks (think <em>Winter's Bone</em>). This book, also set in the Ozarks, is a fictional account of an explosion and fire at a dance hall in 1929 in the town where Woodrell's family is from. Many of the characters are based on real people, including the maid who was inspired by Woodrell's own grandmother. In her version of the events that led to the fire, the rules of class that govern the town and the passion of illicit love prove to be a dangerous and deadly combination. This is a short book, but Woodrell's writing makes you want to slow down and savor a story told by a master.","[npr-staff-picks, realistic-fiction, for-history-lovers, seriously-great-writing, the-dark-side, rather-short, family-matters, book-club-ideas, historical-fiction, rather-short]",0316205850,9780316205856
Robert Martin,How We Do It: The Evolution And Future Of Human Reproduction,"This is one of the best books about sex, and having babies, you're likely to read. I'm not saying ignore the <em>Kama Sutra</em>, <em>What to Expect</em> or even <em>Fifty Shades Of Grey.</em> But if you want to know things like why men have nipples or why it takes a quarter of a <em>billion</em> sperm cells to fertilize <em>one</em> human egg, you should take this white-knuckle ride back through evolutionary time, across continents, into science labs and around your most private parts. It will make you laugh. Your jaw will drop. And the sight of the mismatch between the lives we lead and the bodies we live in will start you thinking.","[npr-staff-picks, science-and-society, eye-opening-reads, its-all-geek-to-me, lets-talk-about-sex, family-matters, for-history-lovers]",0465030157,9780465030156
Ann Leckie,Ancillary Justice,"In this thrilling and complex first novel from Ann Leckie, we plunge into a world of astro-political intrigue. Our hero is on a vendetta to destroy the rulers of a colonial empire that destroyed her starship – but as we read, this typical space opera plot turns into a rich story about how imperialism transforms civilizations as well as the most private thoughts of the individuals in them. We find that our ninjalike hero is actually the fragment of a hive mind that once controlled a starship, and her mission has its roots in a political conflict that stretches back 1,000 years. Come for the page-turning action, and stay for the astonishing character development and world building that will leave you in awe.","[science-fiction-and-fantasy, its-all-geek-to-me]",031624662X,9780316246620
Jesmyn Ward,Men We Reaped: A Memoir,"<p>Jesmyn Ward writes to keep her heart from exploding. <em>Men We Reaped,</em> an accounting of the deaths, in four years, of five men close to her, is beautifully written and gut-wrenchingly sad.</p> <p>""Grief doesn't fade,"" she writes. ""Grief scabs over like my scars and pulls into new, painful configurations as it knits. It hurts in new ways.""</p> <p>Ward writes about her dead brother and dead friends with loving detail: their eyes, their smiles and the color of their skin. Her writing revives the dead men and allows them to speak from beyond the grave: ""Hello. We are here. Listen.""</p>","[npr-staff-picks, biography-and-memoir, science-and-society, the-dark-side, eye-opening-reads, family-matters, seriously-great-writing, book-club-ideas]",160819521X,9781608195213
David Wiesner,Mr. Wuffles!,"You might know David Wiesner from his slightly off-kilter picture books about strange happenings. In his Caldecott winner, <em>Tuesday,</em> an otherwise normal day turns strange when frogs begin to fly through the air on lily pads. His latest book, <em>Mr. Wuffles,</em> is similarly surreal. At the beginning, we meet Mr. Wuffles the cat. He lives in a normal house &mdash; wood floors, striped wallpaper &mdash; but behind the radiator, a small spaceship full of little green aliens has crash-landed. Wiesner tells the story of Mr. Wuffles and the aliens without words. The illustrations are intricate and often funny, as the aliens plot to outwit the cat and escape out the window. Very young readers will pore over the pictures, and any child with a cat will never see the family pet in quite the same way again. (For ages 4 to 8)","[kids-books, funny-stuff, npr-staff-picks]",0618756612,9780618756612
David Finkel,Thank You for Your Service,"Award-winning journalist David Finkel's book <em>Thank You For Your Service</em> is a startlingly intimate and moving portrait of the ""after-war"" &mdash; the enduring emotional wounds of battle for those who've returned from America's wars in Afghanistan and Iraq. Finkel has covered those wars from the front lines for <em>The Washington Post,</em> but here he embeds in the suburban homes and broken families of soldiers living with the ghosts of those battles. There have been many articles about post-traumatic stress disorder and the broken state of mental health care for veterans. But in Finkel's beautifully written and deeply empathetic book, those issues become individual lives and families, impossible to forget.","[npr-staff-picks, science-and-society, eye-opening-reads, the-dark-side, book-club-ideas, family-matters]",0374180660,9780374180669
Meg Wolitzer,The Interestings,"It's hard to write well about modern friendship &mdash; as hard, perhaps, as it is to nurture one. Meg Wolitzer's latest &mdash; and probably finest &mdash; follows a group of friends who meet at arts camp in upstate New York, and go on to a mixture of great successes and minor failures. The characters remain friends for the rest of their lives, and the nature of those friendships and how they ebb and flow within those successes and failures are the novel's most striking achievement. What does it mean to covet a beloved friend's accomplishment, and to really envy his success? Wolitzer writes convincingly about teenagers, and who they become as grown-ups. And she really captures that magical period where all teenagers thought they would grow up to be as special as they were the night of the school play &mdash; only to find that life is less exciting, and more interesting (ha!) than they even thought.","[realistic-fiction, rather-long, family-matters, book-club-ideas, npr-staff-picks]",1594488398,9781594488399
Jill Lepore,Book Of Ages: The Life And Opinions Of Jane Franklin,"It's probably not an exaggeration to say that most Americans aren't even aware that Founding Father Benjamin Franklin had a sister at all. But Jane Franklin Mecom and her older brother were frequent correspondents, and though she didn't have her brother's education, it's undeniable that she shared his brilliance and impatience with lazy thinking. Author Jill Lepore does an admirable job of reconstructing the life of a woman who could have been doomed to obscurity -- and in learning about Jane, we learn more about Ben and the country he helped build. <em>Book of Ages</em> is an endlessly fascinating look at the sometimes tragic, always spirited life of one of early America's most interesting women.","[biography-and-memoir, for-history-lovers, eye-opening-reads, book-club-ideas, family-matters, rather-long]",0307958345,9780307958341
A. Igoni Barrett,"Love Is Power, Or Something Like That: Stories","<em>Love Is Power, Or Something Like That</em> &mdash; a collection of arresting stories by A. Igoni Barrett &mdash; is so much more than its lyrical language, delicious detail and author's love of English &mdash; Nigerian English and English English. A born storyteller, this young writer melds contemporary Nigeria &mdash; Africa's most populous nation and arguably the continent's most bewitching &mdash; with age-old wisdom. Is Barrett a modern-day sage? His prose may shock and startle; but with anguish, violence and cruelty comes compassion.  Barrett artfully captures humanity in these nine tales, adding layers to characters as memorable as Scrooge and <a href=""http://www.npr.org/books/titles/138261444/things-fall-apart"" target=""_blank"">Okonkwo</a>.  A friend gobbled it up in one sitting &mdash; through the night.  A scrumptious read.","[npr-staff-picks, tales-from-around-the-world, poetry, love-stories, rather-short, seriously-great-writing]",1555976409,9781555976408
Mark Fainaru-Wada and Steve Fainaru,"League Of Denial: The NFL, Concussions And The Battle For Truth","The book should come with a warning label for football fans: Watching a game will never be the same after you read it. The authors tell painful stories of NFL players whose names you may recognize &mdash; Mike Webster, Junior Seau, Dave Duerson, to name a few. They introduce you to scientists who fell into researching football-related concussions almost by accident. And they ask tough questions of the NFL, without taking their conclusions too far.","[science-and-society, npr-staff-picks, eye-opening-reads]",0770437540,9780770437541
Dave Eggers,The Circle,"In <em>The Circle,</em> David Eggers thankfully doesn't slam you over the head with WHAT'S WRONG WITH THE KIDS TODAY. Instead, he walks you through a Silicon Valley company &mdash; the Circle &mdash; so very familiar (at least in its own self-mythologizing) that you feel right at home with his almost-heroine, Mae, the newest Circle employee. Mae doesn't just embrace this world; she thrives in it. And it's not just because there are bowling alleys in the employee lounge like a certain tech company we know (*cough* Google ).  This is about the slow boil of the frog: how one gets acclimated to shifting values about privacy, respect and what makes a meaningful relationship.","[npr-staff-picks, mysteries-and-thrillers, its-all-geek-to-me, the-dark-side, rather-long, book-club-ideas]",0385351399,9780385351393
Nicholas Delbanco,"The Art Of Youth: Crane, Carrington, Gershwin, And The Nature Of First Acts","A writer, a painter, a composer. Two of them famous; the third not so much. All died before age 40, leaving masterpieces of art (well, the writer and composer anyway!). Nicholas Delbanco says that Stephen Crane, Dora Carrington and George Gershwin had certain characteristics in common as young creators: All were energetic, exuberant, passionate about their art and received early attention and praise. The book has an academic feel, with literary quotations and helpful analysis. I was moved, thinking about such disparate talents and ambitions emerging in a blaze, then, sadly, dying before their talents could mature.","[biography-and-memoir, science-and-society, for-history-lovers, the-dark-side, npr-staff-picks, for-art-lovers]",0544114469,9780544114463
Elizabeth Strout,The Burgess Boys: A Novel,"A dirty little secret of being an NPR host (OK, for me anyway) is that we read what we <em>have</em> to read, not necessarily what we <em>want</em> to read. But when I saw that Elizabeth Strout had something new, I put it on my personal reading list and devoured it in every spare minute I had. <em>The Burgess Boys</em> is set in Maine and is about two brothers who are bonded by a childhood tragedy. They've each grown up and more or less recovered, but they live very separate lives, until they reluctantly go back home to help a nephew who has been accused of a hate crime. If you have difficult relations with a sibling, if you have ever wondered why a seemingly nice kid does something hurtful and mean, if you've ever had an internal struggle about new people in your neighborhood ... this book offers a gentle but clear-eyed way of thinking about those things.","[npr-staff-picks, realistic-fiction, family-matters, book-club-ideas]",1400067685,9781400067688
Edwidge Danticat,Claire Of The Sea Light,"Claire lives in a village by the sea with her beloved father. Every year on her birthday they visit the grave of her mother, who died giving birth to Claire. But on her seventh birthday, Claire runs away when she realizes that her father, fearing he cannot take care of her, is finalizing plans to give her away to a wealthy woman whose own child was killed in an accident. Claire's disappearance is the catalyst for a series of interlocking stories about the hidden lives and loves of the people in this Haitian village. From the fisherman's hut by the sea to the hillside homes of the rich, this is a revealing portrait that mixes a touch of magic with the tough reality of life in Haiti.","[npr-staff-picks, realistic-fiction, tales-from-around-the-world, family-matters, the-dark-side, book-club-ideas]",030727179X,9780307271792
Sam Wasson,Fosse,"I grew up during the golden era of Broadway choreography, enamored of Michael <em>A Chorus Line</em> Bennett's leaps and extensions, Gower <em>42nd Street</em> Champion's production number overkill and Jerome <em>West Side Story</em> Robbins' storytelling ballets. But no one fired my imagination like Bob Fosse, whose bumping, grinding, undulating dancers in <em>Sweet Charity,</em> <em>Pippin</em> and <em>Chicago</em> often seemed to be all elbows, shoulder rolls and cocked bowler hats. Sam Wasson's <em>Fosse</em> tells us how his early days in burlesque (he was performing on the same stage as strippers from the age of 15) informed his choreography, and why the women he cheated on &mdash; most especially his wife and muse Gwen Verdon &mdash; stuck with him as he was razzle-dazzling every skirt on Broadway and in Hollywood. It's filled with the kind of inside detail that comes of substantial research, and vivid descriptions that turn that research into a sort of movie in your head.","[npr-staff-picks, biography-and-memoir, its-all-geek-to-me, rather-long, for-history-lovers, seriously-great-writing, for-art-lovers]",0547553293,9780547553290
Goli Taraghi,The Pomegranate Lady And Her Sons: Selected Stories,"I have met the pomegranate lady, and you may have as well. If you've ever made a disarmingly intimate connection with a stranger while traveling, you've had the experience. Connections and dislocations drive the characters in these stories: dislocations of place -- exiles who end up in Paris, but never really leave Iran behind, and dislocations of time -- elites who preserve a bubble of the ""old,"" secular, drinking, partying Iran -- upon which modern, revolutionary Iran intrudes, with tragic-comedic results. Constantly moving between cultures is not easy on these individuals -- but perhaps because of that, it reveals so much raw humanity, both cruelty and compassion.","[realistic-fiction, poetry, npr-staff-picks, tales-from-around-the-world]",039306333X,9780393063332
"Habeeb Salloum, Muna Salloum, Leila Salloum Elias",Sweet Delights From A Thousand And One Nights: The Story Of Traditional Arab Sweets,"Bake baklava? Forget it. Mine always comes out gummy and sodden, unlike the crisply perfumed trays I get UPS'd from Detroit's <a href=""http://www.shatila.com/"" target=""_blank"">Shatila Bakery</a>. (There, now you have my best dinner party secret.) That unctuous alchemy of nuts and honey dates from the 10th century, when princes and caliphs wrote cookbooks, sometimes in rhyme. Habeeb, Muna and Leila Salloum's recipes stretch from the Gulf States to the Levant to North Africa and include both contemporary and historical versions (although sheep fat is thankfully replaced by butter). They also trace the DNA of Arab sweets in food from around the world, including cannoli, <em>tres leches</em> cake and ice cream cones.","[cookbooks-and-food, science-and-society, for-history-lovers, npr-staff-picks, tales-from-around-the-world]",1780764642,9781780764641
Alaya Dawn Johnson,The Summer Prince,"In a far-future, post-nuclear-apocalypse Brazil, artist June and her best friend, Gil, find their lives upended when Gil falls in love with their city's newly elected Summer King, Enki. Yes, it's a post-apocalyptic, slightly dystopian teen love triangle, but with a twist: Our heroine becomes the third wheel in a sensitively depicted romance between her two male friends. And the antagonists in the city's ossified government aren't entirely unsympathetic. <em>The Summer Prince</em> is that rare young adult title that's comfortable with ambiguity and nuance &mdash; bolstered with solid world-building and well-seasoned with tropical rhythms.","[young-adult, tales-from-around-the-world, science-fiction-and-fantasy, npr-staff-picks, its-all-geek-to-me, love-stories]",0545417791,9780545417792
Allen Salkin,From Scratch: Inside The Food Network,"Do you like food? Do you like gossip? Do you like TV? Terrific. Fire up the slow cooker and open up a copy of Allen Salkin's <em>From Scratch: Inside the Food Network.</em> It's the behind-the-scenes story of the birth of the network that served up stars like Emeril Lagasse, Bobby Flay, Rachael Ray and the notorious Paula Deen. Sure, it's bursting with juicy bits &mdash; the spliced-in porn on <em>Too Hot Tamales,</em> Rachel Ray almost burning down Emeril's set &mdash; but it's also the story of how cooking shows went glam, from PBS on weekend mornings all the way to Giada's lustrous locks and Paula's butter balls. Bonus: It's a fascinating primer on the pioneers of early cable television.","[cookbooks-and-food, science-and-society, npr-staff-picks]",0399159320,9780399159329
Mohsin Hamid,How To Get Filthy Rich In Rising Asia,"This novel, by Mohsin Hamid, employs the conceit of a how-to book for South Asians. Its exemplar is a country boy on the make, a serious character whose essence remains his own yet who stands as a figure representative of his time and place. Each of the chapter titles offers a sometimes straightforward, sometimes ironic imperative. ""Move to the City."" ""Get an Education."" ""Don't Fall in Love."" ""Learn from a Master,"" and so forth. Given the unabashed gimmickry of Hamid's how-to design, it's a wonderful surprise to find his book so engaging.","[realistic-fiction, tales-from-around-the-world, book-club-ideas]",1594487294,9781594487293
Tash Aw,Five Star Billionaire: A Novel,"Five people make the journey from Malaysia to Shanghai. One is a rising pop star; another, a businesswoman with a surprising past. There's the country girl determined to make good in the city, and the wealthy boy trying to discard a family legacy. They all sound like archetypes you've met before, but the subject of this wonderful novel isn't really any of them &mdash; it's the booming city of Shanghai, and the questions it poses to those who move there: In a city of more than 20 million, what do you have to do to stand out, and in the end, do you really want to?","[realistic-fiction, tales-from-around-the-world, book-club-ideas]",0812994345,9780812994346
David Rakoff,"Love, Dishonor, Marry, Die, Cherish, Perish: A Novel","David Rakoff's posthumous first novel, written in rhyming verse that's more akin to Dr. Seuss than T.S. Eliot, is a seductive heartbreaker. Its 12 cleverly connected vignettes span much of the 20th century and are filled with the sly, sharp social commentary that made him a perennial favorite on <em>This American Life.</em> Spinning rhymes like ""San Francisco"" and ""Crisco,"" ""paradise"" and ""pubic lice,"" and ""Christian Lacroix"" and ""bourgeois"" while dying at 47 from cancer, Rakoff infused <em>Love, Dishonor, Marry, Die, Cherish, Perish</em> not just with his withering wit but with a piercing, wistful appreciation for life, love and art.","[realistic-fiction, poetry, love-stories, seriously-great-writing, rather-short, book-club-ideas, historical-fiction]",038553521X,9780385535212
Tim Leong,Super Graphic: A Visual Guide To The Comic Book Universe,"Infographics, which utilize eye-popping design to convey data with cleverness and clarity, are, let's admit, a fairly nerdy pursuit already. Tim Leong takes the whole thing several steps further, creating flat-out beautiful charts and diagrams to quantify and calibrate the chaotic world of superhero culture with wit and ruthless efficiency. (""A Venn Diagram of Superhero Comic Tropes,"" for example, reveals the five heroes and one villain who exist at the nexus of Cape, Tragically Dead Parents, and Underwear on the Outside.) Hugely fun, and impeccably done.","[comics-and-graphic-novels, its-all-geek-to-me, science-fiction-and-fantasy, rather-short, funny-stuff, eye-opening-reads, for-art-lovers]",1452113882,9781452113883
Susan Choi,My Education,"<em>My Education</em> can be roughly described as an academic novel, but unlike many books in that category, it's thrilling and edgy. There's no school song here, and nobody sits in a study sipping sherry. Instead, Susan Choi's main character, graduate student Regina Gottlieb,  falls madly in love with her sexy professor's gorgeous wife, and they begin an affair that becomes all-consuming, causing Regina to completely lose interest in everyone and everything else &mdash; including her studies. Choi writes evocatively and excitingly about passion, and equally so about youth &mdash; that fleeting, fascinating and all-too-recognizable time of life.","[realistic-fiction, love-stories, lets-talk-about-sex, seriously-great-writing, book-club-ideas]",0670024902,9780670024902
Marie Arana,Bolivar: American Liberator,"He was born into a fabulously wealthy family in 1783. He drove the Spanish monarchy out of Venezuela, Colombia, Panama, Ecuador, Bolivia and Peru. He loved Voltaire and Montesquieu; he died at 47, impoverished and exiled; he inspired generations of dictators and democrats. In Marie Arana's hands, the life of Simon Bolivar is a rousing adventure, fit for the big screen &mdash; a drama of military triumph and Enlightenment ideals blemished by brutal authoritarianism. Popcorn not included.","[science-and-society, tales-from-around-the-world, biography-and-memoir, for-history-lovers, rather-long]",1439110190,9781439110195
Ayana Mathis,The Twelve Tribes Of Hattie,"<p>Ayana Mathis' debut novel lays out the lives of the Shepherd family -- two parents and nine children, each drawn with tenderness and complexity. Hattie and August move to Philadelphia from Georgia in 1923, during the Great Migration of African-Americans. The characters face gritty realities, but the author crafts their stories with pitch-perfect authority and grace. Her language manages to be both luminously metaphorical and down to earth. One tidbit: Franklin, an alcoholic seaman in 1969 Vietnam, recalls, ""the seawater was syrup on my body."" Does a much-talked-about book (an Oprah pick) deserve the ballyhoo? In this case, yes.</p><p><em>Some books from December 2012 were published too late to make it on last year's roundups; they were considered as candidates this year.</em></p>","[realistic-fiction, for-history-lovers, eye-opening-reads, book-club-ideas, seriously-great-writing, historical-fiction, family-matters]",0307949702,9780307949707
