author,title,text,tags,isbn,isbn13
Jo Walton,The Just City,"Never has a book argued so engagingly with Plato's <em>Republic</em> by way of Mary Renault's </em>The Last of the Wine</em>! Across time and space, whenever people read <em>The Republic</em> in the original Greek and pray to Athena to live there, the goddess plucks them from their historical moment and transports them to the island of Thera before its volcano exploded, telling them that they have a unique time-locked opportunity to build Plato's dream city themselves — unaware that the god Apollo is incarnated among them as a young boy so that he can begin to understand consent. Utterly wonderful.","[historical-fiction, its-all-geek-to-me, science-fiction-and-fantasy]",0765332663,9780765332660
Seth Dickinson,The Traitor Baru Cormorant,"The Empire of Masks has devoured Baru's home and way of life with paper currency and restrictive sexual and domestic practices, forbidding her island's freer sexuality and family structure as unhygienic. Baru is determined to fight back — by joining the Empire as a civil servant and destroying it from within. Hiding her desire for women as deeply as her desire for vengeance, Baru navigates intrigues in far-flung Aurdwyn, first thwarting and then orchestrating regional rebellions for increasingly murky ends, while trying hard to keep her soul intact.","[identity-and-culture, ladies-first, science-fiction-and-fantasy, seriously-great-writing, the-dark-side]",0765380722,9780765380722
"Richard Price, writing as Harry Brandt",The Whites: A Novel,"Let's clear one thing up right away: The noun in the title refers to perps that got away — the ""great white whales"" of a cop's career. For Billy Graves, that was one Jeffrey Bannion. But now Bannion is dead, Graves is stonewalled, and a strange colleague named Milton Ramos is threatening his family, even though Graves doesn't know that yet. It all adds up to a confusing swirl of a procedural, but believe me, you'll want to get sucked down this dizzying drain, as intricately detailed as Richard Price's <em>Lush Life.</em> The author wanted to use a pseudonym so he could write a more commercial book. In the end, he wrote a more commercial Price book — which means it's terrific.","[mysteries-and-thrillers, realistic-fiction, the-dark-side]",0805093990,9780805093995
Olen Steinhauer,All The Old Knives: A Novel,"Put down whatever you're reading, or doing, and pick up Olen Steinhauer's newest spy thriller, a book so taut and, yes, brilliant that it will make your other entertainments seem pale and poorly written. The remarkable thing about it is that nearly the entire novel consists of a conversation between Henry and Celia, two former CIA agents at the Vienna station — and former lovers, as well. Their dinner in Carmel-by-the-Sea, Calif., is in complete contrast to the hostage crisis six years earlier that the two of them raced to resolve — and that Henry can't forget.",[mysteries-and-thrillers],1250045436,9781250045430
Jax Miller,Freedom's Child: A Novel,"Drunk barkeep Freedom Oliver isn't who she says she is, and when her long-buried criminal past reaches its tentacles toward the Oregon town where she's landed, Freedom has to choose between her own anonymity in witness protection and the safety of the two children she gave up for adoption as part of her plea bargain. There's a lot going on in this novel by first-timer Jax Miller, and if you're after a perfectly plotted gem, look elsewhere — but if you're looking for something original, compelling and voice-y, you're in for a treat.","[family-matters, mysteries-and-thrillers]",0804186804,9780804186803
"Heda Margolius Kovály, translated by Alex Zucker","Innocence; Or, Murder On Steep Street","Thank goodness Soho Crime had the taste and intelligence to publish this 1973 gem of Czech crime fiction. Heda Kovaly, a Holocaust survivor and memoirist (Under A Cruel Star), wrote Innocence based on her own experience of 1950s Prague, and its gnarly twists and turns mimic the steep climb up that city's Castle Hill. You think the main character is lonely Helena Nováková — but her narration is just part of the story. Once your seat belt is fastened, Kovaly takes you on a ride as thrilling for its literary mastery as for its bleak mystery. Caveat lector: You may find the end unsatisfying. But the bulk of the novel is so amazing you won't care, and you'll mourn the fact that Kovaly never wrote another.","[historical-fiction, mysteries-and-thrillers, tales-from-around-the-world]",1616954965,9781616954963
Joseph Kanon,Leaving Berlin: A Novel,"If you haven't already, read The Good German, Joseph Kanon's first Berlin novel (and, for good measure, see the movie starring George Clooney and Cate Blanchett). However, you needn't do so to enjoy Leaving Berlin, a stand-alone set in the very, very cold winter of 1948, when the divided capital was in physical ruins and crisscrossed by agents playing mental games at the highest levels of espionage. Alex Meier, a young Jewish writer who escaped to America before the war, finds that his communist past puts him afoul of the swaggering U.S. authorities. They offer him a legal way back to America: spying in exchange for a passport. Unfortunately, they want him to spy on the love of his life.","[historical-fiction, mysteries-and-thrillers, tales-from-around-the-world]",1476704643,9781476704647
Christopher Bollen,Orient: A Novel,"If your previous acquaintance combining Long Island and thrillers is limited to the novels of Nelson DeMille, prepare for something completely different, and much more complex. In the slow-to-gentrify North Fork town of Orient, a series of deaths and disturbing events unites the community against a troubled young loner named Mills Chevern, who has been taken in by architect Paul Benchley. Benchley and a local real estate agent named Beth Shepherd try to fend off nasty accusations against Chevern, while Shepherd's disturbing sculptor husband, Gavril, hosts soirees for his high-end artist pals, giving Christopher Bolen (an editor at Interview magazine) plenty of spicy sauce for his rich and suspenseful stew.","[mysteries-and-thrillers, rather-long]",0062329952,9780062329950
A.X. Ahmad,The Last Taxi Ride: A Ranjit Singh Novel,"The second installment of A.X. Ahmad's Ranjit Singh mystery series is even better than the first (The Caretaker). Ex-Indian army Capt. Singh has left Martha's Vineyard for the shadowy streets of Manhattan, where he's now driving a taxi and attempting to save enough money to have a well-appointed second bedroom for his daughter's visits from their home country. When Bollywood star Shabana Shah is murdered after an encounter with Singh, police suspect the worst — but Singh knows something even more terrible connecting the beautiful actor with a bizarre and lucrative underworld industry. Great pacing and unforgettable details make this a procedural not to be missed.","[mysteries-and-thrillers, tales-from-around-the-world]",1250020441,9781250020444
Heidi Cullinan,Fever Pitch,"Closeted Aaron hooks up with out-and-proud — and harassed — Giles, then arranges to go to the same small private Midwest college Giles is attending. Mixed signals have the boys circling each other warily, but when they finally come together, the relationship is intense — and brings down the wrath of Aaron's father. Buoyed by campuswide support, especially from a music department that's like a second family, Aaron begins to feel safe, but a truly malevolent enemy is determined to keep them apart forever. A touching romance that spotlights how devastating (and sometimes dangerous) coming out can be, as well as the healing power of love and music.","[family-matters, for-music-lovers, identity-and-culture, lets-talk-about-sex, love-stories]",1619226189,9781619226180
Kristan Higgins,If You Only Knew,"A winning story of two sisters navigating love and betrayal, from romance star Kristan Higgins. Wedding dress designer Jenny is determined to leave behind the ex-husband who abandoned her but still wants to be ""best friends,"" so she moves back to her suburban hometown — just in time for her sister Rachel's seemingly perfect marriage to implode. Rachel loves her comfortable life but feels she can't trust her husband. Meanwhile, Jenny is drawn to her emotionally wounded neighbor — and has to keep a secret that puts undue pressure on both sisters' romantic relationships. Poignant, funny and richly entertaining.","[book-club-ideas, family-matters, love-stories, realistic-fiction]",037378497X,9780373784974
Mary Robinette Kowal,Of Noble Family,"In this final installment of Mary Robinette Kowal's ""Glamourist"" series, illusion-casting glamourists Jane and Vincent travel to Antigua to deal with the death of Vincent's father, Lord Verbury — a cruel despot who has left behind a ruined estate and terribly abused, angry slaves. Verbury's machinations from beyond the grave trap Jane and Vincent on his plantation — but all is not as it seems, and they end up both helping and learning from a clever community of native glamourists who have crafted a rich society beyond the reach of the island's landowners. A perfect end to a not-to-be-missed series.","[historical-fiction, love-stories, science-fiction-and-fantasy]",0765378361,9780765378361
Sonali Dev,The Bollywood Bride,"A Bollywood superstar with an icy reputation, Ria travels to Chicago for a friend's wedding — and has to face Vikram, the first love she left behind. Convinced Ria abandoned him to pursue fame and fortune, Vikram at first tries to avoid her, but finally gives in to temptation. However, when the secrets Ria tried to bury are unearthed, Vikram re-examines their painful history. It may be too late to be Ria's hero, but he'll do everything he can to help her save herself. An exquisite, romantic novel with haunting universal themes.","[family-matters, identity-and-culture, lets-talk-about-sex, love-stories, tales-from-around-the-world]",1617730157,9781617730153
Marisa de los Santos,The Precious One: A Novel,"After her estranged father falls ill, Taisy Cleary returns to the town where she grew up and becomes embroiled in the life of her half-sister, 16-year-old Willow. Home-schooled Willow is floundering in her first year of private school, but she's not exactly ready to accept any help from her long-gone sister. As the two adjust to each other, Willow's world broadens and Taisy reconnects with a lost love, and they each learn to redefine and expand their ideas of love and family. Smart, vibrant, textured and lyrical.","[book-club-ideas, family-matters, love-stories, realistic-fiction]",0061670898,9780061670893
Beatriz Williams,Tiny Little Thing,"Tiny Hardcastle is supporting her husband's 1966 bid for Congress when a series of unexpected events make her question everything — especially the secret fling she had, just before her wedding, with her husband's cousin Caspian. Caspian returns from Vietnam a wounded hero, and their attraction flames back to life just as suggestive photos surface, Tiny's husband becomes furtive, his family turns intimidating and her capricious sister arrives in trouble: lots of ""tiny little things"" that add up to concern, if not danger. An elegant and stylish story that pays homage to a lost era while exploring timeless themes of love, romance and finding yourself.","[historical-fiction, lets-talk-about-sex, love-stories, realistic-fiction]",0399171304,9780399171307
Tessa Dare,When A Scot Ties the Knot: Castles Ever After,"At 16, shy Madeline dodged the London marriage mart by creating a fictional suitor, a captain off fighting Napoleon. She sent him letters for years to maintain the ruse, before claiming he had died. But sometimes odd twists of fate are the answers to silent prayers, the culmination of barely acknowledged dreams. When the war ends, Madeline is a spinster in a remote Scottish castle — and then one Captain Logan shows up, demanding her hand in marriage in exchange for concealing the years of love letters mistakenly routed to him. <em>When a Scot Ties the Knot is lovely,</em> romantic and thought-provoking.","[historical-fiction, lets-talk-about-sex, love-stories]",0062349023,9780062349026
Lori Ostlund,After The Parade: A Novel,"A man named Aaron leaves his longtime partner to move to San Francisco and begin a new life as a teacher of English as a second language — while confronting the dark corners of his Midwestern childhood, including his father's abuse and sudden death. <em>After the Parade</em> is a sprawling, hefty narrative — deeply sad and profoundly moving — and its prose is like a second protagonist: Vibrant, living and practically lifting off the page.","[family-matters, realistic-fiction, seriously-great-writing]",1476790108,9781476790107
Emily Schultz,The Blondes: A Novel,"Hazel, a graduate student who has been having an affair with her married professor, discovers her pregnancy and witnesses the beginning of an epidemic on the same terrifying day. The mysterious illness, in which blond women attack strangers with rabid ferocity before dying themselves, seizes the country, and Hazel struggles to get home in the midst of the madness. <em>The Blondes</em> is scary and deeply, bitingly funny — a satire about gender that kept me reading until 4 in the morning — and a fine addition to the all-too-small genre of feminist horror.","[book-club-ideas, ladies-first, mysteries-and-thrillers, science-fiction-and-fantasy, the-dark-side]",1250043352,9781250043351
Adrienne Celt,The Daughters: A Novel,"In this lush, finely wrought novel, a professional opera singer named Lulu has a child and loses both her voice and beloved grandmother in the same day. Certain that this has happened because of a curse that stalks the women in her lineage, she plumbs the depths of her past and her heritage to confront it. Equal parts feminist fairy tale and elegy, <em>The Daughters</em> is a gorgeous exploration of music, family history and motherhood","[book-club-ideas, family-matters, for-music-lovers, ladies-first, rather-short, science-fiction-and-fantasy, seriously-great-writing]",1631490451,9781631490453
Lidia Yuknavitch,The Small Backs Of Children: A Novel,"A photographer takes a picture of a young girl in Eastern Europe, running from the explosion that's just atomized her parents and brother — and with that image the photographer's friend, a writer grappling with the long-ago loss of her infant daughter, is undone. To help her, other artists — friends, lovers, family — mobilize to locate the girl in the midst of war. This erotic, beautifully disturbing exploration of sex and violence is a fast, lyrical read, but don't let the brevity fool you — its effects will linger long after the last page.","[for-art-lovers, lets-talk-about-sex, rather-short, realistic-fiction, tales-from-around-the-world]",0062383248,9780062383242
Lauren Acampora,The Wonder Garden,"These linked short stories probe the hidden lives of a small Connecticut town. <em>The Wonder Garden</em>'s protagonists may seem like your ordinary upper-class New England suburbanites, but lurking underneath are stories both grotesque and tragic: a man who becomes obsessed with touching a human brain; a woman who has stopped her car at a stop sign and can't bring herself to start it again; an artist who covers a client's home in giant insects. A weird and compelling collection.","[poetry, realistic-fiction, seriously-great-writing]",0802123554,9780802123558
Vanessa Garcia,White Light,"An artist with a faltering career encounters the opportunity of a lifetime, immediately before her father's sudden death. As her grief unspools, so does the narrative — in which her memories of him, and her thoughts about his life and death, can only be filtered through the many paint colors she uses to create her masterpiece. A beautiful meditation on the creation of art and difficult familial love.","[book-club-ideas, family-matters, for-art-lovers, realistic-fiction, seriously-great-writing]",0991355547,9780991355549
"Kelly Sue DeConnick, illustrated by Valentine De Landro",Bitch Planet Vol. 1: Extraordinary Machine,"If you like your feminism dangerous, this is the comic for you. In a near-future where society has been taken over by the ""fathers,"" women branded ""non-compliant"" — too opinionated, too fat, too unmanageable — are deposited on a prison planet awash in violence and nudity straight out of a 1970s exploitation flick. Kelly Sue DeConnick's story is wildly original and Valentine De Landro's art is down-and-dirty. Particularly fun are the old-fashioned comic book ads between chapters, like one for X-Ray Specs: ""The Perfect Way to See Through His Intentions!""","[book-club-ideas, comics-and-graphic-novels, ladies-first, science-fiction-and-fantasy, the-dark-side]",1632153661,9781632153661
edited by Tom Devlin,"Drawn & Quarterly: 25 Years Of Contemporary Cartooning, Comics And Graphic Novels","Here's one for the comics maven on your shopping list — even if that's you. Venerated publisher D&Q has gone all-out with this 776-page anniversary tome. Works by alt-comics luminaries Chris Ware, Daniel Clowes, Joe Sacco, Adrian Tomine, Art Spiegelman, Peter Bagge, Lynda Barry and Julie Doucet intermingle with creations by a bevy of up-and-comers, plus numerous essays on the form. Want to remember why comics can be an intellectual treat? This volume does the trick.","[comics-and-graphic-novels, for-art-lovers, rather-long]",177046199X,9781770461994
Ed Piskor,Hip Hop Family Tree Book 3: 1983-1984 (Vol. 3),"Ed Piskor navigates the convoluted history of early-'80s urban culture with a buoyant combination of insight and good cheer. He captures such moments as the Beastie Boys' transition from hardcore to rap, the rise of the Fat Boys, the creation of Whodini's <em>Escape</em>, and Russell Simmons and Rick Rubin's forging of the Def Jam label. His graphical skills are formidable. Though he works in a huge, 9-inch-by-13-inch format, each page barely seems to contain its subjects' energy.","[comics-and-graphic-novels, for-art-lovers, for-history-lovers, for-music-lovers, identity-and-culture, its-all-geek-to-me, nonfiction]",160699848X,9781606998489
"John Lewis, Andrew Aydin, illustrated by Nate Powell",March: Book Two,"Comic books are known for their heroes, but the heroes in U.S. Rep. John Lewis' comic are largely nameless; they're found among the tens of thousands of people who participated in the civil rights struggle of the 1960s. Lewis, who headed the Student Non-Violent Coordinating Committee, downplays his own actions — and humbles other notable figures too. Artist Nate Powell keeps the speeches and meetings from being dull. His pen skitters and dances, imbuing every human face and form with explosive potential.","[biography-and-memoir, comics-and-graphic-novels, eye-opening-reads, for-history-lovers, identity-and-culture, nonfiction]",1603094008,9781603094009
"Shigeru Mizuki, translated by Zack Davisson",Showa: A History of Japan 1953-1989,"Celebrated manga artist Shigeru Mizuki, who died in November, put his quirky personality and passionate moral sense on display in this history of 20th-century Japan. In four volumes Mizuki alternated between historical events – with a bias toward the scandalous and macabre – and personal experience. In this final volume his occasional departures from reality, as when he apparently has a mental breakdown from overwork, add an unsettling but fascinating note. Mizuki's sketches of Japan and New Guinea, with his patented blend of clashing styles, are piquant and engaging throughout.","[biography-and-memoir, comics-and-graphic-novels, for-history-lovers, identity-and-culture, nonfiction, rather-long, tales-from-around-the-world]",1770462015,9781770462014
Riad Sattouf,"The Arab Of The Future: A Childhood In The Middle East, 1978-1984: A Graphic Memoir","Riad Sattouf's pen frisks and wiggles, but his drawings and his message are more complex than they appear. Telling of his childhood in Libya, Syria and France in the early 1980s, Sattouf — a former contributor to the French humor magazine <em>Charlie Hebdo</em> — denounces pan-Arabism and Islamic politics. This graphic memoir has been compared to <em>Persepolis</em>, Marjane Satrapi's graphic novel about growing up in Iran. In fact, it's a kind of anti-<em>Persepolis</em> in its icy cynicism.","[biography-and-memoir, book-club-ideas, comics-and-graphic-novels, family-matters, identity-and-culture, nonfiction, tales-from-around-the-world]",1627793445,9781627793445
Jennifer Hayden,The Story Of My Tits,"Life surges and flows, unstoppable, in Jennifer Hayden's graphical autobiography. It may be organized around Hayden's experience of having breasts and losing them to cancer, but it's far more than just a record of the existence of two bumps of flesh. It's also a rebuttal to the forces of illness and early death. Hayden shouts back with everything she has. Placed alongside dozens of other experiences in this long book, cancer isn't allowed to shove joy, hope and humor offstage.","[biography-and-memoir, comics-and-graphic-novels, family-matters, ladies-first, nonfiction]",1603090541,9781603090544
Sydney Padua,The Thrilling Adventures Of Lovelace And Babbage: The (Mostly) True Story Of The First Computer,"With her look at the first computer, Sydney Padua transforms punch cards and little brass cogs into the stuff of legend. Her Victorian heroes are nothing if not memorable: The larger-than-life computational genius Charles Babbage, Padua writes, was a ""blend of Mr. Pickwick, Mr. Toad, Don Quixote and Leonardo da Vinci."" The once-overlooked, eccentric math whiz Ada Lovelace smokes a pipe and scribbles equations. Padua's exaggerated, loopy drawing style keeps the energy high. Her characters gasp and glower and grin; their hair ruffles in the steam.","[comics-and-graphic-novels, eye-opening-reads, for-history-lovers, historical-fiction, its-all-geek-to-me, ladies-first]",0307908275,9780307908278
Ann Leckie,Ancillary Mercy,"It would be a mistake to go into <em>Ancillary Mercy</em> hoping for the same lightning-strike of <em>Ancillary Justice</em>. The first installment of Ann Leckie's trilogy opened a world; by now, things are so complicated for protagonist Breq that all you can hope for is to be satisfied. Luckily, <em>Mercy</em> delivers. The world-building particularly shines in the machinations of this closing chapter, as Breq tries to use her new political powers to stop a war with all the weapons the Radchaai Empire has at its disposal: insinuation, shifting loyalties and the second-best tea set.",[science-fiction-and-fantasy],0316246689,9780316246682
"translated by Malcolm C. Lyons, illustrated by Coralie Bickford-Smith",Tales Of The Marvellous And News Of The Strange,"It's hard to imagine shaking off the dust of this thousand-year-old volume of stories (recently discovered in an Istanbul library) and seeing them for the first time. As thoughtful as they are wondrous, these tales run the gamut: epic and domestic, charming and chilling, realistic and magical, with prose like a jewel box. If it looks scholarly at first glance, take heart; by the time God folds up the desert to help a lost heroine find her way across a strange land, this collection will have made itself at home in your imagination.","[for-history-lovers, poetry, science-fiction-and-fantasy, tales-from-around-the-world]",0141395036,9780141395036
"Kyung-Sook Shin, translated by Ha-Yun Jung",The Girl Who Wrote Loneliness: A Novel,"Kyung-Sook Shin's work often inhabits the space between story and reality. This novel — about a girl who isn't quite her, working in a factory and going to school in the 1970s — is framed with the modern life of ""the author,"" in a time and place she haunts more than really lives in. Until her youth is laid out and the truth told, she's trapped in echoes of life: negotiating family in the past, staring at an unfinished manuscript in the future. It's a story of the pasts that build us, and it makes for one of the most absorbing reads of the year.","[family-matters, historical-fiction, identity-and-culture, tales-from-around-the-world]",1605988634,9781605988634
"Franz-Xaver von Schönwerth, translated by Maria Tatar, illustrated by Engelbert Suss",The Turnip Princess And Other Newly Discovered Fairy Tales,"The history of this rediscovered collection is its own magic: Once upon a time, Franz Xaver von Schönwerth collected fairy tales from Bavaria, where they remained hidden for 150 years until their rediscovery. The tales (translated by Maria Tatar) are fascinating — free of bowdlerized retellings, they have all their original, fiercely oddball appeal. Some are echoes of familiar stories and some are new and occasionally bizarre, but all are alive with personality (lazy flax-harvesting maidens beware). It's a collection equally at home in an academic library and a kid's room — if your kids are ready for a little darkness in their fairy tales.","[for-history-lovers, kids-books, poetry, science-fiction-and-fantasy, the-dark-side]",0143107429,9780143107422
