author,title,text,tags,isbn,isbn13
Cris Beam,To The End Of June,"Over five years, Cris Beam follows 22 foster children as they search for the holy grail: adoption into a stable, loving home. But as the kids and the foster parents can attest, it takes more than good intentions to make a family. A loving couple officially adopt their foster daughter only for her to run away, scared off when she realizes even adoption can't heal the wounds of a 21-home childhood. Beam, a foster parent herself, delivers an engaging, narrative-driven investigation that centers on one of the system's most divisive questions: Does separating children from their birth parents do more harm than good?","[npr-staff-picks, the-dark-side, eye-opening-reads, science-and-society, family-matters, book-club-ideas]",0151014124,9780151014125
Cathy Marie Buchanan,The Painted Girls,"Belle epoque Paris springs to life under the sure hand of Cathy Marie Buchanan, who delivers a world in <em>The Painted Girls</em> that is earthy, delicate and seductive. Edgar Degas is a central figure during the creation of his signature sculpture, <em>Little Dancer, Aged Fourteen.</em> Two real-life characters, aspiring adolescent ballerina Marie van Goethem and her older sister, Antoinette, narrate the story in alternating chapters, offering contrasting perspectives on a life of struggles and hard-won pleasures.","[realistic-fiction, for-history-lovers, for-art-lovers, family-matters, tales-from-around-the-world, book-club-ideas, historical-fiction]",1594486247,9781594486241
Robert Galbraith,The Cuckoo's Calling,"A thoroughly satisfying crime novel &mdash; even if you didn't know it was really written by J.K. Rowling. Set in London, with a private investigator appealing enough that you'll long for his next assignment, <em>The Cuckoo's Calling</em> is tightly plotted and faithful to the genre in all the right places. More than this, it's an original tale with robust characterization and witty, yet forceful criticism of our obsession with celebrity and of the destructive power of the press. The best part is that you won't be able to guess, until nearly the very end, whodunit.","[realistic-fiction, mysteries-and-thrillers, rather-long, the-dark-side, book-club-ideas]",0316206849,9780316206846
Charles Stross,Neptune's Brood: A Space Opera,"The prolific science-fiction writer Charles Stross is so famous for his speculative economic tales that even Nobel laureate Paul Krugman is a fan. And this book is probably his greatest work of economic science fiction yet, a whimsical retelling of <em>Debt: The First 5000 Years</em> by David Graeber. It's the tale of a sexbot in a future where humans have gone extinct multiple times, and a financial instrument that could destroy the solar system. Funny and smart, this is the perfect mind-bender for people who are addicted to the Economist.","[science-fiction-and-fantasy, its-all-geek-to-me, funny-stuff]",0425256774,9780425256770
Jessica Francis Kane,This Close: Stories,"Jessica Francis Kane's second collection is filled with uncertain women adrift in an increasingly complicated world. Kane explores the anxieties and preoccupations of her characters with such empathy that you worry about them as you might about a troubled friend. She offers intimate insights into characters like spiky, exhausted, forlorn Mary Anne Leary, who appears in four stories, before and after the death of her son, and Elizabeth, who takes to her bed with depression. We know these people. We recognize their all-too-human flaws. They are our family, our friends and neighbors. They are us, at our most vulnerable.","[poetry, realistic-fiction, family-matters, rather-short, seriously-great-writing]",1555976360,9781555976361
Louise Penny,How The Light Gets In: A Chief Inspector Gamache Novel,"This is a mystery worth disconnecting all electronic devices and staying home for.  <em>How the Light Gets In</em> is the ninth novel in Louise Penny's extraordinary series featuring Chief Inspector Armand Gamache and his troubled sidekick, Inspector Jean-Guy Beauvoir, of the Surete du Quebec. Penny has been working throughout her series to tap into the spiritual dimensions of the genre, consequently, this novel is one part foul play; two parts morality play. Gamache and his skeleton crew of loyal police allies must root out an epic conspiracy and the battle between good and evil that ensues rivals the faceoff between the heavenly army and Lucifer's fallen angels in <em>Paradise Lost.</em>",[mysteries-and-thrillers],0312655479,9780312655471
Amy Thielen,The New Midwestern Table: 200 Heartland Recipes,"If you've grown up with certain ideas &mdash; maybe certain bland, beige ideas &mdash; about Midwestern food, think again. Food Network host Amy Thielen's big, generous book shares the stories of the modern-day hunters, foragers and farmers who have brought the heartland's foodways back to life. She has a free hand with the salt pork, bacon and butter, but we can argue about that after you've tried the fancy meatloaf with the mushrooms and the pistachios. (Thielen and I went to cooking school together a long time ago, but I can wholeheartedly recommend this book without regard to that acquaintance.)",[cookbooks-and-food],0307954870,9780307954879
Marcus Sakey,Brilliance,"What if the X-men were real?  They'd probably have powers a lot like Marcus Sakey's ""brilliants"" &mdash; endowed not with disbelief-straining flight or laser eyes but with accelerated human talents like pattern recognition, programming and strategy.  And they'd have a much more destructive influence than guys like Magneto ever dreamed of. Brilliants wreck the stock market, for example, before the book even starts. The government, of course, is hunting down brilliants, desperate to keep them out of sight &mdash; but our hero, Agent Nick Cooper, is hiding some explosive secrets of his own. <em>Brilliance</em> is a tightly plotted thriller with classic questions beating in its geeky heart.","[young-adult, science-fiction-and-fantasy, its-all-geek-to-me, mysteries-and-thrillers, npr-staff-picks, rather-long]",1611099692,9781611099690
David Rosenfelt,"Dogtripping: 25 Rescues, 11 Volunteers, And 3 RVs On Our Canine Cross-Country Adventure","David Rosenfelt is the author of the funny and suspenseful Andy Carpenter thrillers, and he's just as funny in this nonfiction account of his move from California to Maine with his 25 rescue dogs. Any book that makes it sound fun to drive in a Winnebago for days with 11 volunteers and 25 dogs has to be good.","[npr-staff-picks, biography-and-memoir, funny-stuff]",1250014697,9781250014696
Tom Gauld,You're All Just Jealous Of My Jetpack: Cartoons,"The titular phrase of Tom Gauld's precise and wryly hilarious collection of cartoons (culled from his weekly gig at Britain's <em>Guardian</em> newspaper) is delivered midblastoff by an astronaut named ""Science Fiction,"" as he leaves a disapproving crowd of black-clad, tut-tutting shoe-gazers collectively dubbed ""Literary Fiction"" in his spectacular cloud of exhaust. Gauld's both a literature nerd and a science-fiction nerd whose deadpan mashups &mdash; Dickens and a megalosaur; the Brontes and Super Mario (""Level 02: The Moor"") &mdash; belong on the same shelf as R. Sikoryak, Michael Kupperman and Kate Beaton.","[comics-and-graphic-novels, funny-stuff, rather-short, its-all-geek-to-me]",1770461043,9781770461048
Mason Currey,Daily Rituals: How Artists Work,"Mason Currey details the work habits of dozens of modern artists (painters, sculptors, composers, choreographers, filmmakers, scientists and writers) from Gertrude Stein to Mahler, Gershwin, Shostakovich, Freud, Jung, Proust, Erik Satie, Joyce Carol Oates, Malamud, Stephen King, Joseph Heller, Darwin and many more. When do they wake up, when do they sit down to write or chisel stone, splash paint, and when do they eat, drink, laugh, love, sleep? It's all here &mdash; from the compulsions of Flaubert to the drug addiction of Ayn Rand &mdash; in this amazing and entertaining compendium of how geniuses apply themselves.","[biography-and-memoir, science-and-society, for-history-lovers, eye-opening-reads, for-art-lovers]",0307273601,9780307273604
Karen Russell,Vampires In The Lemon Grove: Stories,"This singular collection kicks off with a title story that does the near impossible: It makes me care about vampires &mdash; a breed more overexposed these days than Labrador retrievers. Other tales are in a literary league far beyond familiar orbits. ""Reeling for the Empire,"" for instance, imagines a sweatshop in 19th-century Japan where girls spin silk and, as they're doing so, metamorphose into silkworms. The instant anthology keeper, though, is called ""Proving Up."" It's a Gothic tale of homesteading in Nebraska that dramatizes the payment &mdash; in sanity and mortality &mdash; that the land demanded from settlers. The daffy-to-devastating sweep of these stories will leave readers reeling.","[poetry, science-fiction-and-fantasy, funny-stuff, seriously-great-writing]",0307957233,9780307957238
Jaclyn Moriarty,A Corner Of White,"It's traditional for fantasy heroes to leave their small towns for great adventures. But a series of disasters, from failing crops to falling fairies, keeps Elliot stuck at home. In modern-day Cambridge, England, Madeleine struggles to survive with her mother, and dreams of her rich, world-traveler father taking them back. Elliot's father is missing, too: He vanished a year ago after an attack of rogue colors. (In Elliot's fantastical Kingdom of Cello, visible wavelengths are living creatures, variously benign or deadly.) But though Madeleine and Elliot can't leave, they discover a way to send messages through a tiny rift between their universes. Their conversations are charming, funny, whip-smart and heartbreaking.","[young-adult, science-fiction-and-fantasy, love-stories]",0545397367,9780545397360
Erica Jong,Fear Of Flying: A Novel,"Is it cheating to pick everyone's favorite book of 1973 as a favorite in 2013? Who cares, when that book is the 40th anniversary edition of <em>Fear of Flying.</em> Erica Jong's seminal &mdash; I know, I know, but can you blame me? &mdash; work on female sexuality is worth rereading for two reasons. One, it's a great book, with a warm and funny heroine &mdash; more than a zipless read, if you will. It's simply fun to read the adventures of the deeply likable Isadora Wing, and it's sexy as hell. And two, once you've read it, you can listen to the inimitable Susan Stamberg's look back with Jong on the environment that created <em>Fear of Flying</em> and why it's still important, 40 years later. The icing on the cake? Jong's seductive alto reading from her work, and Mama Stamberg giggling over the zipless f- - -.","[realistic-fiction, love-stories, lets-talk-about-sex, for-history-lovers, eye-opening-reads, npr-staff-picks, book-club-ideas]",0805098585,9780805098587
Katherine A. Powers (editor),"Suitable Accommodations: An Autobiographical Story Of Family Life: The Letters Of J.F. Powers, 1942-1963","It's hard to talk about J.F. Powers, the Catholic writer who crafted a modern American classic with his 1962 novel, <em>Morte d'Urban,</em> without resorting to superlatives. Powers, who died in 1999, is possibly the most underappreciated fiction author of his generation, and quite likely the funniest. This collection of Powers' letters to his family and friends is addictive, delightful and alternately hilarious and heartbreaking. Edited by his daughter, journalist Katherine A. Powers, <em>Suitable Accommodations</em> is a fine introduction to the work of the greatest Minnesota writer in history.","[biography-and-memoir, for-history-lovers, rather-long]",0374268061,9780374268060
"Juan Gabriel Vasquez, translated by Anne McLean",The Sound Of Things Falling,"Law professor Antonio Yammara thinks he's indifferent to Colombia's history of drug-related violence. Then a motorcycle roars by, a stray bullet pierces his gut and the terror suppressed for a decade comes flooding in. We've seen enough morality tales about cops and dealers, victims and addicts. <em>The Sound of Things Falling</em> provides a more sophisticated pleasure: a vision of how drugs have unraveled a generation, one humble life at a time.","[realistic-fiction, tales-from-around-the-world, seriously-great-writing]",1594487480,9781594487484
Martha Ronk,Transfer Of Qualities,"Martha Ronk has been an experimental poetry darling for years, but this may indeed be her breakthrough: It's a series of prose meditations on objects found in rooms and the pressures they exert on the people going in and out of those rooms. Ronk has a cold, analytical tone that breaks suddenly and surprisingly into feeling in the oddest places. Is this poetry? Who knows, who cares &mdash; it's really, really good.","[poetry, science-and-society, seriously-great-writing]",189065082X,9781890650827
Suzanne Hayes and Loretta Nyhan,I'll Be Seeing You,"Written entirely through letters, this novel chronicles the correspondence of two very different women who help each other through the trials, triumphs and tragedies of war. Rita is a middle-aged professor's wife in Iowa with a husband and son in battle, while Glory is a young wife and mother in Massachusetts whose husband has enlisted. Despite their differences, the two develop a deep friendship, and readers are treated to an exquisitely rendered snapshot of life on the home front. A must-read for anyone even vaguely interested in the World War II era, with romance woven through the details.","[love-stories, realistic-fiction, for-history-lovers, family-matters, book-club-ideas, historical-fiction]",0778314952,9780778314950
Dash Shaw,New School,"Dash Shaw makes comics that set out to unsettle, using the unique tools the medium provides to expose discomfiting truths about relationships both familial and romantic. A proud experimentalist, Shaw often shuns tidy narrative conventions in favor of raw emotion. His striking and enigmatic graphic novel <em>New School,</em> about two brothers who find work at a massive historical theme park called Clockworld, allows him to poke at a host of ideas about foreignness, sexuality and, obliquely, the making of art. It's a masterful, gorgeous and defiantly odd work that demands close attention &mdash; and richly rewards it.","[comics-and-graphic-novels, family-matters, for-art-lovers, the-dark-side, seriously-great-writing]",1606996444,9781606996447
"Kathy Brennan, Caroline Campion",Keepers: Two Home Cooks Share Their Tried-And-True Weeknight Recipes And The Secrets To Happiness In The Kitchen,"Do you need another book claiming to offer quick weeknight dinners? Well, you need this one. <em>Keepers</em> is highly focused &mdash; it's dinner and dinner only, and not one of its recipes will set you back more than 45 minutes. At the same time, these two former <em>Saveur</em> editors make no compromises on taste or quality. Even their shortcuts &mdash; a pack of frozen vegetables, store-bought puff pastry &mdash; are in the service of deliciousness (in this case, a fast chicken pot pie).",[cookbooks-and-food],1609613546,9781609613549
Marie Brennan,A Natural History Of Dragons: A Memoir By Lady Trent,"This delightful alternate history takes place in a Victorian England where naturalists are eagerly creating phylogenies of dragons. It's the memoir of a scientist whose books about dragons are the definitive works in the field. But of course, all brilliant scientists have to start somewhere, and this book chronicles how a young woman in a male-dominated world managed to talk her way into dangerous scientific expeditions, and make incredible breakthroughs in the understanding of how dragons reproduce, fly, and speciate. Though a fantasy, this novel is truly a homage to the history of science – and its brave, no-nonsense heroine will win you over with her passionate love for field research (and her love for a bookish young man, too).","[science-fiction-and-fantasy, for-history-lovers, its-all-geek-to-me, love-stories]",0765331969,9780765331960
Robert Hilburn,Johnny Cash: The Life,"Johnny Cash became a legend long before he died, and there's no doubt that he's one of the most iconic American musicians of all time. Figures as beloved as the ""Man in Black"" present a hazard for biographers &mdash; it's easy for chronicles of their lives to turn into hagiographies. Journalist Robert Hilburn deftly avoids this trap in <em>Johnny Cash,</em> which is as fascinating as it is honest. Cash wouldn't have been who he was if it weren't for his capacity for both love and sin, and Hilburn's portrait of a genius in constant battle with his demons is as absorbing as any biography published this year.","[biography-and-memoir, for-history-lovers, rather-long, for-art-lovers]",0316194751,9780316194754
NoViolet Bulawayo,We Need New Names: A Novel,"Shortlisted for the 2013 Man Booker Prize, this astonishing debut is narrated by Darling, a young girl from Zimbabwe. She is feisty, knowing and determined and she narrates in a distinct, powerful voice. Darling must face head-on the social trauma caused by a corrupt and derelict leadership and the ambivalent impact of the international NGO aid business. All this is subtly woven into what is, most important, the story of one unforgettable child who knows there has to be more to life than hunger and want &mdash; and of what happens when her dreams come true.","[realistic-fiction, tales-from-around-the-world, seriously-great-writing]",0316230812,9780316230810
Austin Grossman,YOU,"<em>YOU</em> is a surreal, melancholy character study of a group of high school gamers who grow up to be semi-legendary videogame developers. Austin Grossman turned superheroes into socially awkward neurotics in his previous novel, <em>Soon I Will Be Invincible</em>, and here he turns game development into a dangerous, often-deadly quest. As our hero tries to find a bug in the game he is desperately trying to finish, he is also working through the senseless death of his friend, who created the first version of the game. In part, the book is a stylistic exploration of videogame writing, offering us pages of object and character descriptons just as they would be written before being converted into the code of a game. But it's also a coming-of-age story about how we never leave our fantasies behind. They become more real, and more powerful, as we age.","[science-fiction-and-fantasy, its-all-geek-to-me]",0316198536,9780316198530
Stephen Burt,Belmont: Poems,"Stephen Burt is the leading poetry critic of his generation, one of contemporary poetry's most well-known advocates, but he is also a formidable poet himself. In this, his third and best book, he is moved to song by the challenges, whimsies and ecstasies of fatherhood and suburban life. These poems are all kinds of tender; they're funny, too. Most of all, they're made wise by a father's careful attention to all his children know.","[poetry, seriously-great-writing, funny-stuff, family-matters]",1555976441,9781555976446
Charles Simic,New And Selected Poems: 1962-2012,"Charles Simic is justifiably famous, having taken poetry by storm in the late '60s and '70s with compact lyrics that combine a wry, Eastern European sense of humor with memories of a childhood haunted by war. Anyone who likes poetry has probably read at least a few of his surreal-seeming poems, which tell more of the truth than they let on. This the first selection of Simic's poems to span the six decades during which Simic has been writing, making it an essential book.","[poetry, seriously-great-writing]",0547928289,9780547928289
Jillian Weise,The Book Of Goodbyes,"Jillian Weise, who won this year's Laughlin Award for an outstanding second book of poetry, is a force of nature. This collection follows up her debut, <em>The Amputee's Guide to Sex,</em> with what happens when sex becomes love that just won't go away &mdash; no matter how unsuitable the beloved seems to be. This is love poetry for the 21st century: hot, hip and heart-rending.","[poetry, lets-talk-about-sex, seriously-great-writing]",1938160142,9781938160141
Rebecca Lee,Bobcat And Other Stories,"Rebecca Lee is a virtuoso &mdash; ironic, original, cosmopolitan. Standouts in this first collection are ""Fialta,"" about a love triangle set at an invitation-only workshop run by the ""architect of the prairies,"" and the title story, in which the hostess of an elaborate Upper West Side dinner party discovers her husband is cheating. In an eerie parallel, a guest describes a bobcat attack in Nepal: "" … when blood leaks out of a body, the body loses its pulsing internal clock, and all understanding of time is released. The soul becomes loosed from the body and unhinged from time simultaneously and begins to roam freely about … ""","[poetry, the-dark-side, seriously-great-writing, realistic-fiction, seriously-great-writing, book-club-ideas, lets-talk-about-sex]",1616201738,9781616201739
Anthony Marra,A Constellation Of Vital Phenomena: A Novel,"The title is hard to wrap your mind around. It comes from a medical textbook's definition of ""life."" Set during Chechnya's wars for independence from Russia, Anthony Marra's novel begins in a small village where a young girl's father has just been taken away by government troops. Her rescuer, the village doctor, seeks refuge in a barely functioning urban hospital run by a brilliant surgeon -- a still-young woman whose emotions have been stripped bare by war. These and the other characters whose lives run through this story of life in the midst of war are among the most memorable I have ever encountered. They will break your heart and keep you reading.","[npr-staff-picks, realistic-fiction, for-history-lovers, tales-from-around-the-world, seriously-great-writing, eye-opening-reads, book-club-ideas, historical-fiction, family-matters]",0770436404,9780770436407
Dan Fagin,Toms River: A Story Of Science And Salvation,"You wouldn't necessarily expect the story of a dye manufacturing facility to be one of intrigue, insurrection, deception and death. But Dan Fagin's narrative of the arrival and explosive growth of a chemical plant in New Jersey in the 1950s weaves a complex tale of powerful industry, local politics, water rights, epidemiology, public health and cancer in a gripping, page-turning environmental thriller. Fiercely reported and accentuated with lessons in both historical science and modern medicine, <em>Toms River</em> is a tale of toxic waste, and the families and communities left in its wake.","[npr-staff-picks, science-and-society, eye-opening-reads, for-history-lovers, the-dark-side, rather-long]",055380653X,9780553806533
Yoko Ogawa,Revenge: Eleven Dark Tales,"As you read this weird and mesmerizing collection you find Yoko Ogawa ascending into an orbit at least as high as Haruki Murakami's &mdash; as in the story ""Sewing for the Heart,"" which features a bag designer whose customer is a woman with her heart growing on the outside of her chest; or in the flatly told but utterly bizarre trio of linked stories ""Welcome to the Museum of Torture,"" ""The Man Who Sold Braces"" and ""The Last Hour of the Bengal Tiger."" Ogawa stands on the shoulders of giants, as the saying goes. But this collection may linger in your mind &mdash; it does in mine &mdash; as a delicious, perplexing, absorbing and paradoxically singular experience.","[poetry, the-dark-side, rather-short, realistic-fiction, tales-from-around-the-world]",0312674465,9780312674465
Eli Brown,Cinnamon And Gunpowder: A Novel,"Set sail with uptight chef Owen Wedgwood and rowdy pirate ""Mad Hannah"" Mabbot for a rollicking tale of haute cuisine on the high seas.  Wedgwood is a talented but prissy chef to a shipping magnate until Mabbot shoots his employer point-blank and takes him captive. She offers him a deal no chef can refuse: your life in exchange for one magnificent dinner a week, made from whatever's in the ship's larders.  Skim the family-drama back story, and savor instead Wedgwood's MacGyver-like ingenuity as he cobbles together bread starters, pheasant mole and brandied mango tart amid the chaos of a pirate ship.","[realistic-fiction, cookbooks-and-food, for-history-lovers, npr-staff-picks, book-club-ideas]",0374123667,9780374123666
Ben Katchor,Hand-Drying In America: And Other Stories,"In his latest collection of comics mini-stories, the creator of the brilliant <em>Julius Knipl, Real Estate Photographer</em> gently interrogates the everyday &mdash; the click of a light switch, say, or the nozzle on a can of shaving cream &mdash; and finds unimagined and uncanny depths within. Ben Katchor sets up an intriguing tension between his rough, riotous, almost impressionistic figures and backgrounds and the voice of his captions, which enumerate salient story points with the dry, implacable plainness of a 1950s plumbing-fixture catalog. Elliptical and mysterious but never abstruse, the picture-poems of <em>Hand-Drying in America</em> celebrate the mundane world around us by revealing it to be anything but.","[comics-and-graphic-novels, rather-short, eye-opening-reads, for-art-lovers]",0307906906,9780307906908
