author,title,text,tags,isbn,isbn13
Randall Munroe,Thing Explainer: Complicated Stuff In Simple Words,"Randall Munroe — the former NASA roboticist behind the beloved <a href=""http://xkcd.com/"" target=""_blanks"">xkcd</a> webcomic — breaks down complex stuff into simple terms ... really simple terms. The Large Hadron Collider? That's a ""Big tiny thing hitter."" The Mars rover? That's a ""Red world space car."" And for those of us who don't love heights, isn't ""fear porch"" really the best possible term for a balcony? Munroe relies exclusively on 1,000 of the most commonly used words in the English language to define and explain everything from your large intestines (""big food hallway"") to NASA shuttles (""flying space trucks."") And with witty, playful diagrams, you'll be understanding nuclear reactors (""heavy metal power buildings"") in no time.","[staff-picks, comics-and-graphic-novels, eye-opening-reads, funny-stuff, its-all-geek-to-me, nonfiction]",0544668251,9780544668256
Linda Hirshman,Sisters In Law: How Sandra Day O'Connor And Ruth Bader Ginsburg Went To The Supreme Court And Changed The World,"The title tells all: <em>Sisters in Law: How Sandra Day O'Connor and Ruth Bader Ginsburg Went to the Supreme Court and Changed the World.</em> Linda Hirshman's joint biography of the first and second women to serve on the nation's highest court is a gossipy, funny, sometimes infuriating and moving tale of two women so similar and yet so different. O'Connor, a lifelong Republican, was raised on a Western ranch and cut her political teeth as majority leader of the Arizona Senate. <a href=""http://www.npr.org/sections/itsallpolitics/2015/10/26/450547606/notorious-rbg-the-supreme-court-justice-turned-cultural-icon"" target=""_blank"">Ginsburg</a> was born and bred in Brooklyn, the daughter of a Russian Jewish immigrant, and became a professor and litigator. But as different as their backgrounds were, and even their approaches to judging, when it came to women's rights, O'Connor and Ginsburg were allies. They began their careers at a time when women could be denied jobs, credit, even a place on a jury. But they always had an amazing self-confidence, believing that they could be lawyers and leaders.","[staff-picks, biography-and-memoir, book-club-ideas, eye-opening-reads, for-history-lovers, ladies-first, nonfiction]",0062238469,9780062238467
Ashlee Vance,"Elon Musk: Tesla, SpaceX, And The Quest For A Fantastic Future","Elon Musk is a real man, but also a cartoon superhero. He decided to take on the biggest challenges on Earth — as well as in outer space — and launched not one, but three companies: Tesla Motors, the luxury electric car brand; SpaceX, the private firm that wants to slash the cost of space travel; and SolarCity, which is led by his cousin from South Africa. When I told a 5-year-old friend about the entrepreneur's life, he said, preciously: ""He is doing too much. He needs to focus."" Sound advice for a man who doesn't seem to know how to take advice. Musk is all over the place. The biography by Ashlee Vance is not. It's a page-turning read with brilliant detail. And quite a testament to the reporting. When Musk refused to participate in interviews, Vance circled his friends and family and became such a pain, the superhero caved, and talked.","[staff-picks, biography-and-memoir, book-club-ideas, its-all-geek-to-me, nonfiction]",0062301233,9780062301239
Jamie Bartlett,The Dark Net: Inside The Digital Underworld,"<em>The Dark Net</em> is a meticulously researched and reported look at the hidden world of cryptocurrency, anonymous Web browsing and online subcultures. Information technology has carved out small spaces of almost absolute freedom while simultaneously enabling mass surveillance and tracking. Author Jamie Bartlett takes a fair, thoughtful approach to the subject, and if you've ever wondered what a bitcoin is or how both child pornographers and political freedom fighters hide out online, <em>The Dark Net</em> serves as a great introduction.","[staff-picks, its-all-geek-to-me, nonfiction, the-dark-side]",1612194893,9781612194899
Kate Beaton,"Step Aside, Pops: A Hark! A Vagrant Collection","I depend on Kate Beaton's comic strips when I need a good, hearty giggle. Her latest collection features hilarious parodies of classic literature, history and pop-culture, with brilliant caricatures of everyone from Lord Byron to Ida B. Wells and Wonder Woman. Highlights include her blistering takedowns of ""strong female characters"" and ""cool girls,"" as well as her cheeky depiction of hairy-legged, bra-burning ""straw feminists,"" who sneak into children's bedrooms to swap a Justin Bieber poster for one of a busty Mother Earth. And if you thought <em>Wuthering Heights</em> was too ridiculous to parody, Beaton finds a way to make it even more deliciously weird.","[staff-picks, comics-and-graphic-novels, for-history-lovers, funny-stuff, ladies-first, rather-short]",1770462082,9781770462083
Lynsey Addario,It's What I Do: A Photographer's Life Of Love And War,"In 2011 photojournalist Lynsey Addario was kidnapped in Libya. She was covering the fighting between dictator Moammar Gadhafi's troops and rebel forces when the car she was traveling in (with three other journalists) was ransacked. She was tied up, assaulted and held for a week. Addario's memoir, <em>It's What I Do,</em> begins with this chilling scene. In her vivid retelling, you can practically hear the bullets whiz by and taste the dirt as she's pushed to the ground with a gun held to her head. It's a story of vulnerability, humanity and courage that will give you an adrenaline rush without your moving a muscle.","[staff-picks, biography-and-memoir, eye-opening-reads, for-art-lovers, ladies-first, nonfiction, tales-from-around-the-world]",159420537X,9781594205378
Nadia Bolz-Weber,Accidental Saints: Finding God In All The Wrong People,"I never would have guessed that my favorite interview of 2015 would be with a Lutheran minister, but Nadia Bolz-Weber isn't your average holy roller. Decked out in sleeve tattoos, she curses like a sailor and has a background in comedy. In 2008 she founded her own church, The House for All Sinners and Saints, which welcomes all walks of life — including addicts, drag queens and nonbelievers. <em>Accidental Saints</em> is a series of unflinchingly honest (and funny) stories about her life as a minister. You don't have to be religious to get something out of this book. Like this: ""Whenever people annoy me beyond reason, I can guarantee it's because they're demonstrating something I'd rather not see in myself."" This is a quick read that will leave you feeling better about yourself and others — for all our flawed, messy goodness.","[staff-picks, biography-and-memoir, book-club-ideas, eye-opening-reads, funny-stuff, identity-and-culture, ladies-first, nonfiction]",1601427557,9781601427557
Andy Goldsworthy,Andy Goldsworthy: Ephemeral Works: 2004-2014,"Andy Goldsworthy creates art from the materials he finds in nature. His sculptures are made from ice sheets, tree branches, snow, clay and rock — he uses leaves like paint. Much of his art is meant to be ephemeral, to decay and degrade with the elements, to exist in a moment. Fortunately, Goldsworthy also photographs this work for us to enjoy and has collected 10 years of his temporary art in this beautiful coffee table book. Plus, if you've ever had the urge to just lie down outside in the rain, Goldsworthy's rain shadow photographs provide you an excuse — you're making art. Another book documenting his more permanent works is due out in spring 2017.","[staff-picks, for-art-lovers]",1419717790,9781419717796
"Neil Gaiman, illustrated by JH Williams III",The Sandman: Overture,"Best-selling author Neil Gaiman made his name writing the horror/fantasy comic book series <em>The Sandman</em> about the godlike character Morpheus, the Lord of Dreaming. Its 75-issue run revealed Gaiman's seemingly limitless imagination — he wrote stories about a convention for serial killers, the gods that view hell as prime real estate for development once Lucifer abandons it, and the premiere of Shakespeare's <em>A Midsummer Night's Dream</em> held for an audience from the fairy realm. For the 25th anniversary of the comic book, Gaiman returned to his beloved characters for a six-issue miniseries. Here, Morpheus is tasked with saving the universe from complete destruction — a destruction he himself set in motion. <em>The Sandman: Overture</em> serves as a prequel to the original series and gives you the chance to read it all over again.","[staff-picks, comics-and-graphic-novels, science-fiction-and-fantasy]",1401248969,9781401248963
Ari Berman,Give Us The Ballot: The Modern Struggle For Voting Rights In America,"In 1965, LBJ signed the Voting Rights Act, wiping away obstacles that had prevented African-Americans from voting, like literacy tests and poll taxes. But what happened after the VRA became law? In <em>Give Us the Ballot,</em> Ari Berman chronicles five decades of political and ideological fights over voting rights. He argues that the law's passage birthed a ""counterrevolutionary"" movement that worked to restrict minority voters through voter ID laws, racial gerrymandering, voting purges and other efforts. Berman's book culminates with the 2013 5-to-4 Supreme Court decision that struck down a key part of the Voting Rights Act. The book seems particularly interesting now that we're in the midst of the first presidential election held since that controversial decision.","[staff-picks, eye-opening-reads, for-history-lovers, identity-and-culture, nonfiction]",0374158274,9780374158279
Pam Muñoz Ryan,Echo,"Stories within stories intertwine as the lives of three children from three vastly different backdrops and time frames set the stage for <em>Echo.</em> From bleak Nazi Germany to a Depression-era orphanage in Pennsylvania, to sunny World War II Southern California, a deceptively simple harmonica becomes a powerful instrument in the hands of each child. Though they never meet, these three are bound together not just by the harmonic notes but by their bravery, determination and heart. Pam Muñoz Ryan's modern classic draws you in, and you will still hear the music, long after the last page is read. (For ages 10 to 14)","[family-matters, for-music-lovers, historical-fiction, kids-books, seriously-great-writing]",0439874025,9780439874021
Mike Wu,Ellie,"Introducing Ellie, an adorable baby elephant. When she hears that her zoo is closing, little Ellie is sad because there's nothing she can do to help ... until she comes across a brush and some paint. As Ellie begins to experiment she discovers that her paintings can help to keep the zoo open. Mike Wu's friendly watercolors harken back to an earlier era of picture books, and this story of hope, determination and creativity saving the day will leave you cheering for <em>Ellie.</em> (For ages 3 to 5)","[for-art-lovers, kids-books]",1484712390,9781484712399
Alex Gino,George,"George has a secret. She knows something no one else does — that she's not a boy, she's a girl. Only, George is too scared to tell people, for fear they won't understand, or they will laugh ... or they will stop loving her. But when George takes on the role of Charlotte in her class's production of <em>Charlotte's Web,</em> she can finally show the world who she really is. Warm, funny and heartbreaking, Alex Gino's incredible debut novel <em>George</em> is one to cherish and share. (For ages 8 to 12)","[family-matters, identity-and-culture, kids-books, realistic-fiction]",1407158279,9781407158273
"Deborah Underwood, illustrated and co-authored by Meg Hunt",Interstellar Cinderella,"Take a classic fairy tale, blast it into outer space, give the heroine a toolbox, and welcome to the world of <em>Interstellar Cinderella.</em> In this upbeat retelling by Deborah Underwood, Cinderella is a whiz at mechanics. When she rescues the prince by fixing his spaceship, he becomes smitten. But will she marry him, or does this Cinderella have other ideas? Debut picture book illustrator Meg Hunt's strong and lively art delves into a palette of deep purples, rusts and blues to show off a galaxy where anything is possible. (For ages 3 to 5)","[funny-stuff, its-all-geek-to-me, kids-books, ladies-first, science-fiction-and-fantasy]",1452125325,9781452125329
Julia Sarcone-Roach,The Bear Ate Your Sandwich,"Prepare to be thoroughly entertained by this delightful story about a missing sandwich and the bear who ate it. Julia Sarcone-Roach's active, engaging and detailed illustrations chronicle Bear's rollicking journey from the forest to the city. The adventure culminates at a park bench where a lunchbox lies open. Hungry, Bear is caught devouring the sandwich. Embarrassed, he longs for the forest and we bid him farewell as he sets sail to return home. A surprise ending will leave you laughing out loud. (For ages 3 to 7)","[cookbooks-and-food, funny-stuff, kids-books]",0375858601,9780375858604
Emily Hughes,The Little Gardener,"This beautifully illustrated book tells the magical tale of a tiny boy who loves his garden more than anything. It provides him with joy, shelter and food; it is his entire world. Sadly, it becomes too much for him to handle alone — and he risks losing it all. Emily Hughes' spare prose allows her gorgeous artwork to tell the story of the gardener and the single flower that brings him inspiration and hope. Layered with meaning, this is a book worth lingering over and cherishing. (For ages 3 to 7)",[kids-books],1909263435,9781909263437
Kat Yeh,The Truth About Twinkie Pie,"Toss together daring hairdos, an incredible cast of characters and a whole lot of delicious desserts and you've got the recipe for a delightful page-turner. Whip-smart 12-year-old GiGi is the new girl at a posh New York school. However, her hairdresser sister, her trailer park past and a suitcase full of family secrets threaten to unravel GiGi's life. In this scrumptious debut novel, Kat Yeh creates a world so wonderful you're never going to want to leave. (For ages 8 to 12)","[family-matters, funny-stuff, kids-books]",0316236624,9780316236621
Pamela Zagarenski,The Whisper,"Pamela Zagarenski's <em>The Whisper</em> is an invitation to stretch your imagination. A girl is lent an enchanted book by her teacher and, as she heads home, the words fly out and are caught by a sly fox who may have a story of his own. Disheartened by the wordless pages, the girl hears a whisper, ""You can imagine the stories."" Slowly, she begins to spin her own tales and learns to become a storyteller. Gorgeous paintings with rich colors and exquisite details will have you lingering over each page and creating stories of your own. (For ages 4 to 7)",[kids-books],0544416864,9780544416864
"Emily Jenkins, illustrated by Paul O. Zelinsky","Toys Meet Snow: Being The Wintertime Adventures Of A Curious Stuffed Buffalo, A Sensitive Plush Stingray, And A Book-Loving Rubber Ball","Whether you're already acquainted with Lumphy, StingRay and Plastic from their chapter books, or are just meeting them now, you're sure to love <em>Toys Meet Snow.</em> As the three venture out into the snow for the first time, their unique personalities shine through. Each toy's impressions and observations are full of imagination and charm. Emily Jenkins' masterful text is deceptively simple, and Paul O. Zelinsky's warm and wonderful illustrations make this book an enchanting read for all seasons. (For ages 3 to 7)",[kids-books],0385373309,9780385373302
"Eve Bunting, illustrated by Lauren Castillo",Yard Sale,"Yard sales can be fun — but not when your favorite things are being sold. Callie's move from a house to a small apartment is told with warmth and compassion. As she watches her family's belongings being picked over and purchased, Callie's heartache is palpable. Lauren Castillo's watercolor and ink illustrations compliment Eve Bunting's tender first-person telling of a routine event. However, <em>Yard Sale</em> is wholly Callie's story, and we are heartened by her realization that though their belongings are gone, her family remains together to comfort and love one another. (For ages 3 to 7)","[family-matters, funny-stuff, kids-books]",0763665428,9780763665425
"Tammi Sauer, illustrated by Goro Fujita",Your Alien,"New friends can come from far-flung places ... or planets. In this charming story, a boy meets a little green alien. Instantly, the two become inseparable, sharing fun and adventures. However, at bedtime, the boy sees his new friend growing sad. Hard as it is, he must somehow help his friend get home. In <em>Your Alien,</em> Tammi Sauer captures the giddy joy of friendship and the heartbreak of saying goodbye. This, coupled with Goro Fujita's friendly and engaging illustrations, will make you long for an alien friend of your own. (For ages 3 and up)","[funny-stuff, kids-books, science-fiction-and-fantasy]",1454911298,9781454911296
Carson Ellis,Home,"A gentle meditation on the idea of what constitutes a home, Carson Ellis' picture book is whimsical and thought-provoking. Her lovely watercolor illustrations imbue both the grand (Slovakian duchesses' mansions) and the familiar (an urban apartment) with ornate charm, but it is her inspired depictions of the odd (a Norse god's castle and a mysterious estate encased in a geodesic dome) that make the book stand out. Best of all, in the final illustration of Ellis' own studio (""An artist lives here""), each piece of bric-a-brac ties back to the vignettes shown previously, a detail attentive rereaders will surely find delightful. (For ages 4 to 8)","[family-matters, for-art-lovers, kids-books]",0763665290,9780763665296
Lucia Berlin,A Manual For Cleaning Women: Selected Stories,"Cleaning ladies are rare characters in literary fiction; so, too, are clerical workers and hospital staff, but they populate Lucia Berlin's stories because Berlin herself held those kinds of jobs before her death in 2004. This collection of 43 of Berlin's stories aims to bring her the recognition she never enjoyed in her own rocky lifetime. You can imagine the narrators of these stories sitting down next to you in a bar after work, ordering a first shot and, unbidden, starting to talk about their crappy days. Berlin had been around the block a few too many times to sugarcoat things. But her one-of-a-kind voice and vision make these stories well worth the pain.","[staff-picks, book-club-ideas, poetry, realistic-fiction, seriously-great-writing]",0374202397,9780374202392
Denise Inge,A Tour Of Bones: Facing Fear And Looking For Life,"When Denise Inge's husband, John, was appointed the bishop of Worcester Cathedral in 2008, she discovered their new house was built over an ossuary, or ""charnel house."" The bones of Benedictine monks were collected there in medieval times. It took Inge a while to work up the courage to descend into that cellar. Gazing on all those skulls and femurs brought Inge face to face with the brevity of life and propelled her on a journey, both literal and spiritual, in which she visited bone houses throughout Europe. As a book — part travelogue, part memoir, part memento mori — <em>A Tour of Bones</em> is as strange and inspiring as are any of the bone houses that Inge visited.","[staff-picks, biography-and-memoir, book-club-ideas, eye-opening-reads, nonfiction, tales-from-around-the-world, the-dark-side]",1472913078,9781472913074
George Hodgman,Bettyville: A Memoir,"Last year's literary tour de force about the trials of tending to aged parents was Roz Chast's <em>Can't We Talk About Something More Pleasant?</em>; This year's must-read dispatch from the frontlines of caretaking is George Hodgman's <em>Bettyville.</em> A few years ago, Hodgman, who had enjoyed a highflying publishing career, lost his job and returned to his childhood home in Paris, Mo., to care for his 90-year-old mother, Betty. The kicker is that Betty has never acknowledged that her only son is gay. <em>Bettyville</em> powerfully chronicles the exhaustion and absurdity of eldercare, as well as the psychic cost of maintaining a familial relationship that demands silence.","[staff-picks, biography-and-memoir, book-club-ideas, family-matters, identity-and-culture, nonfiction]",0525427201,9780525427209
John Grisham,Rogue Lawyer,"<em>Rogue Lawyer</em> introduces readers to a so-called street lawyer named Sebastian Rudd. Or, maybe a better term for Rudd would be ""mobile lawyer,"" because, ever since his office was firebombed, he's been operating out of a bulletproof van and not sleeping in the same place for more than a few days. ""Mr. Smooth,"" Rudd is not — he rubs both criminals and cops the wrong way. But, in hallowed Grisham tradition, scrappy Rudd is the defense lawyer you want sitting beside you in the courtroom when things look bleak. The biggest mystery that <em>Rogue Lawyer</em> poses is how John Grisham, at this stage in his long writing career, can still concoct all these distinctive characters, tricky legal predicaments and clever ways to worm out of them.","[staff-picks, mysteries-and-thrillers]",0385539436,9780385539432
Kazuo Ishiguro,The Buried Giant: A Novel,"No novelist around today beats Ishiguro when it comes to writing about loss; and, almost every time he tackles his signature subject, he does so in a different genre: His breakthrough book, <em>The Remains of the Day,</em> is a ""straight"" literary novel in diary form; <em>When We Were Orphans</em> is a detective tale and <em>Never Let Me Go</em> is a sci-fi story. Here, Ishiguro serves up a masterful blend of fantasy, and Arthurian romance and postmodern absurdity.  In <em>The Buried Giant,</em> an exhausted group of medieval travelers cross a blasted landscape straight out of the plays and novels of Samuel Beckett. They ""can't go on,"" but they ""go on"" and so, too, do Ishiguro's readers, through scenes infused with menace and magical beauty.","[staff-picks, historical-fiction, love-stories, science-fiction-and-fantasy, seriously-great-writing]",030727103X,9780307271037
Michael Connelly,The Crossing (Bosch),"In <em>The Crossing,</em> Hieronymus ""Harry"" Bosch, the hero of Michael Connelly's long-running series of police procedurals, has been forced to retire from the LAPD. Harry gives leisure living a halfhearted try, but he finds that the vintage motorcycle he had planned to tinker with as a hobby interests him for about 10 minutes. Indeed, so antsy is Harry that when his half-brother, Mickey Haller (who is himself the hero of Connelly's ""Lincoln Lawyer"" series), asks him to sign on as an investigator, Harry surprisingly agrees. Haller, after all, is the enemy — a criminal defense attorney — and working for him means Harry is ""crossing"" over to the other side. Harry may be officially over the hill as far as the Los Angeles Police Department is concerned, but Connelly is still very much in his prime.","[staff-picks, mysteries-and-thrillers, seriously-great-writing]",0316225886,9780316225885
Elena Ferrante,"The Story Of The Lost Child: Neapolitan Novels, Book Four","For the past few years, Europa Editions has been bringing out Elena Ferrante's series of literary novels about an edgy, decades-long friendship between two women in Naples. The fourth and final of the ""Neapolitan Novels,"" titled <em>The Story of the Lost Child,</em> has just been published. It's spectacular, but you will realize how spectacular it is only if you do not cheat. You must read the three earlier (also superb) Neapolitan Novels, or the perfect devastation wreaked by the conclusion of this last novel will be lost on you.","[staff-picks, book-club-ideas, family-matters, historical-fiction, rather-long, realistic-fiction, seriously-great-writing, tales-from-around-the-world]",1609452860,9781609452865
Stacy Schiff,"The Witches: Salem, 1692","In the haunting opening of <em>The Witches,</em> popular historian Stacy Schiff announces her intention to summon up, rather than solve, the mystery of the witch hunts that racked Salem in 1692. She says: ""Salem represents one of the rare moments in our enlightened past when the candles are knocked out and everyone seems to be groping about in the dark, the place where all good stories begin."" Indeed they do. <em>The Witches</em> surveys the ministers and the odd women easily targeted as witches; the intransient judges; and the teenage girls who found their voice in claiming to be bewitched. Schiff makes the dark an inviting place to linger.","[staff-picks, book-club-ideas, eye-opening-reads, for-history-lovers, ladies-first, nonfiction, rather-long, the-dark-side]",0316200603,9780316200608
T. Geronimo Johnson,Welcome To Braggsville,"T. Geronimo Johnson's timely novel is a tipsy social satire about race. A white, working-class Southerner named D'aron Davenport gets a scholarship to Berkeley — or ""Berzerkeley."" Once there, he's inspired by an alt history course to return to his hometown of Braggsville with some classmates to scrutinize the town's annual Civil War re-enactment. As social satirist, Johnson is an equal opportunity mocker. The smugness of the elite university classroom is mirrored by the anti-intellectualism of Braggsville. <em>Welcome to Braggsville</em> deploys stream-of-consciousness poetry, fantasy and straight-up realism to explore the ways Americans miscommunicate when we try to talk about race.","[staff-picks, book-club-ideas, funny-stuff, identity-and-culture, nonfiction, seriously-great-writing]",0062302124,9780062302120
