author,title,text,tags,isbn,isbn13
Gregory Orr,River Inside The River: Three Lyric Sequences,"Gregory Orr is a kind of oracular bard, praising, in short lyrics that comprise three long sequences in this book, the enduring capacity of the poetic imagination to make real headway toward healing the wounds of old trauma. Orr himself accidentally shot his own brother in a childhood hunting accident, a memory that permeates all his work and, paradoxically, becomes a source of extreme compassion. In these poems, you'll find the year's most convincing case for why poetry matters.","[poetry, seriously-great-writing, the-dark-side, family-matters]",0393239748,9780393239744
Jenni Fagan,The Panopticon: A Novel,"Anais Hendricks is only 15, but she's been in trouble for years. She has a serious drug habit, she's been in foster homes since birth, and she may have put a police officer in a coma. Now, she's been sent to live in the Panopticon, a social-work housing experiment for young people. All of the units face inward toward a tower full of guards, watching the inmates. And believe me, it's worth watching Anais, one of my favorite heroines of the year. The plot of <em>The Panopticon</em> is really secondary to the roller coaster of character that is Anais &mdash; her intense, first-person narration illuminates the horrors of a young woman failed again and again by the system in Scotland, but does it by suffusing the reader with her own funny, compassionate, hard-as-nails self. By the end of the book, you'll know a lot of Scottish slang, which may or may not stick with you. Anais, however, most certainly will.","[realistic-fiction, mysteries-and-thrillers, tales-from-around-the-world, the-dark-side, npr-staff-picks]",0385347863,9780385347860
Holly Black,The Coldest Girl In Coldtown,"Welcome back the other kind of vampire: Mad, bad and dangerous to know, Gavriel is a worthy successor to Lord Byron (the supposed real-life inspiration for 19th century vampire literature, and certainly an influence on Gavriel, who might have spotted him a few rounds at a Venetian gaming hell). Holly Black never lets you forget that vampires are, before everything else, human predators. The morning after a wild party, Tana wakes up to find everyone dead &mdash; except her infuriating ex-boyfriend and a red-eyed boy. To get her vampire-bitten ex to safety, they go on what might be the best (or the worst) road trip in YA history, straight to the heart of Coldtown &mdash; a chillingly believable mix of prison camp and old-Vegas glamour.","[young-adult, science-fiction-and-fantasy, the-dark-side]",1780621299,9781780621296
Will McIntosh,Love Minus Eighty,"Imagine a Jane Austen novel set in one of Philip K. Dick's media-saturated worlds, and you've got the idea behind <em>Love Minus Eighty</em>. Will McIntosh's terrific novel is set in a near-future world where the rich wear full-body computers and are constantly surrounded by virtual ""followers"" who hang onto their every conversation &mdash; while also rating them for hotness and intrigue. While an online dating coach yearns tragically for her colleague in a series of funny, light scenes, a more sinister story unfolds alongside. A cryogenics company creates a ""bridesicle"" program, where women who die young and beautiful are frozen until they can ensnare a man willing to marry them and pay for their revival and medical repairs.","[science-fiction-and-fantasy, love-stories, the-dark-side, rather-long, its-all-geek-to-me]",0316217786,9780316217781
Adrian Matejka,The Big Smoke,"Don't think poetry: think biopic. This collection is ripped from the history books, but not limited to the facts; it's suspenseful, even when we all know the ending; and part of the appeal is watching an artist inhabit a famous figure. The actor here is the poet Adrian Matejka, who masterfully plays the parts of the great African-American heavyweight Jack Johnson and his loving but brutalized women. The grim Jim Crow South, the flashy celebrity lifestyle, the shadowboxing with self-doubt &mdash; everything here drives toward Johnson's legendary Fight of the Century against white champion James Jeffries. These poems are shocking and propulsive, like a prizefighter spitting blood to a soundtrack of Verdi; it's impossible to look away.","[poetry, for-history-lovers, biography-and-memoir, npr-staff-picks, love-stories, the-dark-side]",0143123726,9780143123729
Carla Kaplan,Miss Anne In Harlem: The White Women Of The Black Renaissance,"Carla Kaplan's revelatory cultural history explores the lives of white women &mdash; collectively known to Harlemites by the nickname of ""Miss Anne"" &mdash; who risked family exile and social ostracism to be part of the artistic and political movements of the Harlem Renaissance. Blacks suspected them of sentimentality, as well as appropriating what was thought of as a more ""primitive"" culture. The white world, in turn, diagnosed ""Miss Anne"" as either a lunatic or a sexual vampire. British heiress, Nancy Cunard, for instance, was categorized by the U.S. State Department as a ""white woman who had Gone Negro."" Throughout her fascinating book, Kaplan explores the heavy personal price ""Miss Anne"" paid for defying racial norms.","[biography-and-memoir, for-history-lovers, eye-opening-reads, science-and-society, book-club-ideas, rather-long]",0060882387,9780060882389
Lauren Beukes,The Shining Girls,"In her first book set in the U.S., South African novelist Lauren Beukes defies genre, and she dazzles as she does it. <em>The Shining Girls</em> is a murder mystery, thriller and time travel puzzle all in one. A young girl is left for dead in a brutal and seemingly motiveless attack. An itinerant miscreant steps through the door of a menacing house. As their stories converge (through decades and different locales) to a terrifying climax, the reader also meets a group of women &mdash; each ordinary and yet each a chillingly, and fatefully, designated ""Shining Girl.""","[mysteries-and-thrillers, science-fiction-and-fantasy, the-dark-side]",0316216852,9780316216852
Gene Luen Yang,Boxers & Saints,"At first glance, Gene Luen Yang's clean lines and expressive, humorous cartooning style might make it seem as if his tale of the Boxer Rebellion has been bowdlerized for children. But don't be fooled &mdash; Yang is using his considerable gifts to invite us deeper inside his story, so that its ensuing violence and sadness land all the harder. In one volume, a young boy joins the Boxers, who call on spirit gods to aid them in their fight against foreign interference in China. In the second volume, we see the conflict through the eyes of a young girl who renounces her Chinese name and culture to embrace Catholicism. A nuanced exploration of faith and violence, told with a searching, life-affirming empathy.","[comics-and-graphic-novels, tales-from-around-the-world, for-history-lovers, seriously-great-writing, rather-long, for-art-lovers, eye-opening-reads]",1596439246,9781596439245
Brenda Hillman,Seasonal Works With Letters On Fire,"Activism pervades Brenda Hillman's work, nowhere more than in this collection &mdash; the fourth and final installment in her series of elemental meditations (previous books have treated air, water and earth). Here, she gathers not only jumpy, experimental lyrics but also scraps of occasional prose and images &mdash; anything that will help her make the case that the world is a mess and it's up to us to fix it.","[poetry, eye-opening-reads, seriously-great-writing]",0819574147,9780819574145
"Mary Shelley, Gris Grimly",Gris Grimly's Frankenstein,"Popular culture has never really done justice to the brilliant philosophical novel that is Mary Shelley's <em>Frankenstein.</em> Yeah, there's a reanimated corpse, but he reads Milton and discusses philosophy with his creator, who's in some ways the real monster. Grimly delivers all that, and while he's completely faithful to Shelley's text, he brings a visual style that is totally original: Frankenstein chases his creation through a trippy landscape that is by turns Victorian, modern and futuristic. Grimly draws a creature more gruesome than any movie monster, but simultaneously more sympathetic and human.","[comics-and-graphic-novels, mysteries-and-thrillers, for-history-lovers, the-dark-side, its-all-geek-to-me]",0061862975,9780061862977
Josh Hanagarne,"The World's Strongest Librarian: A Memoir Of Tourette's, Faith, Strength And The Power Of Family","Forget every stereotype you have about librarians. Josh Hanagarne, who works in the Salt Lake City Public Library, is 6 feet, 7 inches and can tear a telephone book in half. <em>The World's Strongest Librarian</em> isn't just one of the most interesting books of the year because of the author's incredible story &mdash; he started weightlifting as a way to manage his Tourette syndrome &mdash; but also because of his considerable charisma and charming prose. ""I only knew that everything coming toward me had the potential to wreck me, to derail any plan I could make,"" Hanagarne writes of his disorder. But he doesn't let it, and his chronicle of his fight is as defiant and inspiring as the (strong) man himself.","[biography-and-memoir, family-matters]",1592407870,9781592407873
Susan Wiggs,The Apple Orchard,"Tess Delaney's life is upended when she discovers a family she never knew she had and a long-lost heirloom that could save their land and the business they've built since arriving in California just after World War II. As a treasure hunter on the cusp of reaching all her professional goals, Tess risks it all when she digs into her family's past, uncovering secrets that may offer understanding, second chances and a shot at romance. Mixed in with the engaging contemporary storyline are flashbacks to Nazi-occupied Denmark and the noble actions of Danish citizens during the war. Intriguing, compelling and lovely.","[love-stories, family-matters, for-history-lovers, mysteries-and-thrillers]",0778314936,9780778314936
Juliana Gray,A Duke Never Yields,"Abigail Harewood never wants to get married, but she aims to live life to the fullest &mdash; which includes taking a lover. She sets her sights on the Duke of Wallingford, who has just sworn off women and pledged sobriety for a year. That's a little problematic, since they share a sizzling attraction and, currently, a Tuscan villa. Loosely based on Shakespeare's <em>Love's Labour's Lost,</em> the book starts out with a sparkling, irrepressible heroine and a brooding, damaged hero and spins a mesmerizing tale of romance and self-realization around their journey to love.","[love-stories, for-history-lovers, lets-talk-about-sex]",0425251187,9780425251188
Alan Bradley,Speaking From Among The Bones: A Flavia De Luce Novel,"Twelve-year-old chemist and detective Flavia de Luce is just fun to read about. In her latest book (the fifth in the series), she tries to unravel a mystery involving hidden corpses, missing treasure, secret passageways, family secrets and a surefire way to scare the heck out of the vicar's wife.","[npr-staff-picks, mysteries-and-thrillers]",0385344031,9780385344036
Adelle Waldman,The Love Affairs Of Nathaniel P.: A Novel,"Of all the novels I've reviewed in 2013, this is the one that everyone &mdash; from my middle-aged friends to my hip graduate student TAs &mdash; wants to borrow. Adelle Waldman's debut is a comic novel of ideas that tracks the loves and literary ambitions of 30-year-old Nate Piven, who lives in Brooklyn. Nate and his smarty-arty friends spend their days writing essays on topics like ""Yoga as the New Orientalism"" and their evenings flirting and quaffing craft brewed beers. You'd think all that erudition might make Nate a ""better"" person, but, alas, he's just another well-read bounder &mdash; one his girlfriends and Waldman's readers find hard to resist.","[realistic-fiction, lets-talk-about-sex, funny-stuff, love-stories, book-club-ideas]",0805097457,9780805097450
Sheri Fink,Five Days At Memorial,"Eight years after the allegations of possible euthanasia at hospitals in the wake of Hurricane Katrina, Sheri Fink grippingly describes the horrible conditions medical staff and patients endured and the tough choices everyone had to make. Regardless of who you consider to be heroes or villains, this book will make you think twice about what you thought you knew about those notorious few days.","[npr-staff-picks, science-and-society, for-history-lovers, eye-opening-reads, the-dark-side, rather-long, book-club-ideas]",0307718964,9780307718969
Khaled Hosseini,And The Mountains Echoed,"In Khaled Hosseini's best novel yet, nine characters must decide what they would (and wouldn't) do for the happiness of their family. Among the options: sell a daughter, kill a sister, protect an alcoholic mother, accept a life of lonely desperation. The novel brims with scenes of Afghan cruelty and generosity, but to Hosseini's credit, there isn't a single villain in sight. After all, even warlords can be nice daddies.","[realistic-fiction, tales-from-around-the-world, family-matters, book-club-ideas]",159463176X,9781594631764
Ron Carlson,Return To Oakpine: A Novel,"The town of Oakpine, Wyo., doesn't exist on maps, but in this new book, Ron Carlson has done a splendid job of making a reader feel at home there. It's also where Jimmy Brand, a successful writer who spent the past 30 years in New York City, returns to die. Long-lost friends gather around him, resuscitating their old rock 'n' roll band in his honor. The music of everyday human speech and the rhythm section of the human heart resonate in this prairie song of a novel.","[realistic-fiction, family-matters]",0670025070,9780670025077
Matt Rassmussen,Black Aperture: Poems,"Where did this strange, sad, gorgeous book come from? Matt Rasmussen is a new poet, but also a founder of Birds LLC, one of the hip, up-and-coming poetry micropublishers. His poems trace the lifelong unfolding of the aftereffects of a brother's suicide in breathtakingly sharp couplets. There are no answers to the questions this book raises, but no one's ever asked them so clearly.","[poetry, the-dark-side, seriously-great-writing, family-matters]",080715086X,9780807150863
Aaron Smith,Appetite,"When it comes to gay identity, race, city life, approaching middle age and family, Aaron Smith is writing some of the best new poems around. He's got a real ear not only for the music of language but for how music &mdash; the kind that comes out of speakers &mdash; and poetry intersect. This book got too little notice: You need to read it ASAP.","[poetry, the-dark-side, seriously-great-writing, for-art-lovers, family-matters]",0822962195,9780822962199
Rosalind Wiseman,"Masterminds And 
Wingmen: Helping Our Boys Cope With Schoolyard Power, Locker-Room Tests,
 Girlfriends And The New Rules Of Boy World","I have a boy, and although I gave birth to him and love him dearly, I sometimes look at him and wonder what alien spaceship dropped him off. So the minute I heard that Rosalind Wiseman was writing a book about boys, I knew I was getting it. (Wiseman also wrote <em>Queen Bees And Wannabes,</em> which inspired the film <em>Mean Girls.</em>)  This book explains so many of the things boys cannot, or will not, explain for themselves. It is based on solid research and, just as important, on the accounts of her ""informants"" &mdash; a diverse (or so she says) group of boys who agreed to answer her difficult questions truthfully. Although I felt at times she glossed over many of the very real racial and class differences that inform the way boys are seen and treated (stop-and-frisk, anyone?) I found much common sense and immediately useful information. Wiseman employs a researcher's eye, a journalist's sharp and accessible hand, and a mother's heart. A rare combination indeed.","[npr-staff-picks, science-and-society, eye-opening-reads, book-club-ideas, family-matters]",0307986659,9780307986658
Nora Ephron,The Most Of Nora Ephron,"Nora Ephron began her writing career as a cub reporter for <em>The New York Post,</em> and during her lifetime she was a journalist, essayist, novelist, screenwriter, playwright and, even briefly, a blogger. All these sides are on display in this volume, which contains the novel <em>Heartburn</em> and the script to her Broadway play <em>Lucky Guy, </em> as well as much more, including her brilliant early essays, which go back to way before she felt bad about her neck. Ephron, who died in 2012, is served well by this collection, which showcases her talent and range and &mdash; perhaps most of all &mdash; her voice.","[for-history-lovers, rather-long, funny-stuff, biography-and-memoir, seriously-great-writing]",038535083X,9780385350839
John Boyne,This House Is Haunted,"<em>This House Is Haunted</em> draws on some of the great ghost-loving writers of the past, Charles Dickens and Henry James foremost among them. It's 1867, perfect timing for a Gothic creepfest. A bereaved governess minds two ""intelligent"" children at Gaudlin Hall in Norfolk, England. Frights close in as no-nonsense protagonist Eliza Caine discovers the string of horrific deaths that have befallen the great house. She suffers ""accidents"" &mdash; attacked by a savage dog, pushed from a window, painfully scalded. ""I find human nature to be a very disturbing thing,"" she opines. Boyle's smart dialogue and scene-setting give the book cinematic appeal.","[for-history-lovers, science-fiction-and-fantasy, the-dark-side, tales-from-around-the-world, historical-fiction]",1590516796,9781590516799
Oscar Martinez,The Beast: Riding the Rails And Dodging Narcos On The Migrant Trail,"Beyond true crime, Oscar Martinez's tremendous investigative report on how thousands of Central American migrants travel through Mexico to the U.S. border reads more like true horror.  Far from home, in legal limbo, the migrants often fall victim to robbery, rape, torture or mass kidnapping by drug traffickers. Why would anyone undertake such a harrowing journey just to become an illegal gardener, housekeeper or factory employee in America? Martinez has the answer.","[science-and-society, tales-from-around-the-world, eye-opening-reads, the-dark-side]",1781681325,9781781681329
Bob Shacochis,The Woman Who Lost Her Soul,"It's a shame novelist and nonfiction author Bob Shacochis isn't already a household name among readers of literary fiction, but I'm hoping that this important and powerful novel will bring him the recognition and readers that he so deserves. Spanning the decades between World War II and the present, from the Cold War to the War on Terrorism, with settings as diverse as Montana, Turkey, the Yugoslav republic of Croatia, Fort Bragg, Haiti, and several deluxe golf courses, this massive (over 700 pages) novel introduces myriad fully realized characters, in five distinct sections whose relationships to one another slowly become clear &mdash; though believe me, when you begin the novel you will have no idea where the plot is going and how it's going to end. I'd have no hesitation in labeling this the first ""Great American Novel"" of the 21st century &mdash; and despite its size and complexity (or maybe because of its size and complexity) I found it riveting.","[realistic-fiction, mysteries-and-thrillers, for-history-lovers, rather-long, tales-from-around-the-world, the-dark-side, seriously-great-writing, lets-talk-about-sex]",0802119824,9780802119827
Sara Gran,Claire DeWitt And The Bohemian Highway,"All those Vikings who've been taking over mystery fiction can now go jump in a fjord! Brooklyn-born author, Sara Gran, has reintroduced a distinctive American voice to the mystery in the guise of her 40-ish, bad-girl detective, Claire DeWitt. In this second outing, DeWitt's investigations into the murder of an old boyfriend take her from the elite Bohemian Grove Club in California to New York's Lower East Side. Along the way, her narration is infused with tough poetry. About being a teenager, Claire says: ""It was a secret world you gained admittance to at fourteen and left at twenty, swearing never to repeat what you'd seen."" Wise readers will zip their lips and stay close to Claire.",[mysteries-and-thrillers],0547429339,9780547429335
Kim Stanley Robinson,Shaman,"It's 32,000 years ago and an adolescent &mdash; Kim Stanley Robinson calls him Loon &mdash; who has been orphaned and taken under the wing of his tribe's shaman hits the road and discovers all he needs to know to survive. Maybe it's because the world Robinson creates feels so authentic and complete, but for several nights running, something happened: I dreamed I was <em>living</em> in Loon's world, traveling in the same tribe, trekking along streams and rivers, through forest and over hill in an ancient state of mind.","[science-fiction-and-fantasy, for-history-lovers, rather-long, family-matters, its-all-geek-to-me]",0316098078,9780316098076
Michael Hainey,After Visiting Friends: A Son's Story,"Who was Michael Hainey's newspaper-reporter father <em>really</em> with on the night he dropped dead? His sons were told one thing; their father's obit alluded to another. So Hainey, now a journalist himself, digs into his dad's life, knowing he may not like what he finds. It's a beautiful story, but the real reason to pick up this book is its atmosphere &mdash; juicy descriptions of journalism in the ‘60s, when editors included ""slot men"" and they smoked and drank and spat into the wastebaskets, cranking out editions of the local paper late into the night.","[npr-staff-picks, biography-and-memoir, for-history-lovers, seriously-great-writing, family-matters, book-club-ideas]",1451676565,9781451676563
Karen Green,Bough Down,"""I worry I broke your kneecaps when I cut you down,"" writes the artist Karen Green in her debut book. ""I keep hearing that sound."" It doesn't get any easier from there &mdash; <em>Bough Down</em> is one of the most heartbreaking books you're likely to read, but it's also one of the most beautiful. A meditation on the 2008 suicide of her husband, the novelist David Foster Wallace, Green's book combines prose poetry with visual art to create something wrenching, powerful and ultimately unclassifiable. It's not only one of the best books of the year; it's one of the most stunning books about grief to come out in decades.","[biography-and-memoir, the-dark-side, rather-short]",193822101X,9781938221019
Jamie Quatro,I Want To Show You More,"<p>Jamie Quatro brings a fresh, frank voice to these linked stories set around Lookout Mountain, Ga. Several feature a character with a husband, family, church &mdash; and guilt over a virtual affair involving phone sex and heavy texting. Her obsession takes a surreal turn in ""Decomposition,"" as her lover's body shows up when she's in bed with her husband. The title comes from a story in which she emails a nude selfie to her lover: </p><p><em>""I want to show you more, I said.</em></p><p><em>""He was silent. Then: So far, we haven't done anything we couldn't tell our spouses about.""</em></p>","[poetry, lets-talk-about-sex, the-dark-side, seriously-great-writing, book-club-ideas, family-matters]",080212075X,9780802120755
"Kelly Sue Deconnick, Dexter Soy, Emma Rios",Captain Marvel Vol. 1: In Pursuit Of Flight,"Talk about reflected glory: As Ms. Marvel, Air Force Major Carol Danvers has been kicking around the Marvel Universe for decades, ever since acquiring her amazing powers simply by standing next to male hero Captain Marvel during an explosion. But in this new series, writer DeConnick has Carol assume the title of Captain Marvel herself, ditch her cheesecake getup for a flight suit, and set off on a temporal adventure that allies her with a squadron of female World War II fighter pilots. Publishers like to tout their ""strong female characters."" But in the hands of DeConnick, they've found something far better &mdash; a rounded, compelling, inspirational hero who happens to be a woman.","[comics-and-graphic-novels, its-all-geek-to-me, science-fiction-and-fantasy, rather-short]",0785165495,9780785165491
"Javier Marias, translated by Margaret Jull Costa",The Infatuations,"If Agatha Christie had adored Michel de Montaigne and Honore de Balzac, she might have produced something like this deliciously deep murder mystery. The novel begins with a seemingly random crime: A businessman is stabbed to death by a homeless madman in Madrid. The solution is a humdinger. But the best parts occur in Javier Marías' hypnotizing meditations on marriage, love, grief, longing, envy, literature and betrayal. As sophisticated as a Bach fugue, <em>The Infatuations</em> is also so intimate that the chapter breaks feel almost like breaths.","[realistic-fiction, tales-from-around-the-world, seriously-great-writing, mysteries-and-thrillers, love-stories]",0307960722,9780307960726
Mary Szybist,Incarnadine,"<p>A religious book for a secular America, this is among the most arresting and inventive collections of the past few years. Mary Szybist turns Christian mythology &mdash; her name is Mary, after all &mdash; on its head with all the reverence of a true believer. She's a restless formal experimenter and a humble, compassionate observer of the complicated glory of the world. If you only read one book of poetry this year, you're not reading enough poetry &mdash; but if it <em>must</em> be one, this should be it.</p><p><em>This book was also the winner of the 2013 National Book Award for poetry.</em></p>","[poetry, seriously-great-writing]",1555976352,9781555976354
